Name,latitude,longitude,Address
aneja associates,18.9986552,72.8260748,"301, Peninsula Towers, Ganapatrao Kadam Marg, Lower Parel West, Lower Parel, Mumbai, Maharashtra 400013, India"
sudit k. parekh & co.,18.9978494,72.8288859,"2002, Urmi Estate, 20th Floor, 95, Ganpatrao Kadam Marg, Nagin Nagar Chawl, Dhuru Wadi, Lower Parel, Mumbai, Maharashtra 400013, India"
khimji kunverji & co.,19.0112551,72.83740259999999,"Level-19, Sunshine Tower,, Senapati Bapat Marg,, Elphinstone Road,, Babasaheb Ambedkar Nagar, Mumbai, Maharashtra 400013, India"
n.a.shah associates,19.0060778,72.8240359,"B 41-45 (4th floor) and 21, 25 (2nd floor, Paragon Centre, Pandurang Budhkar Marg, Lower Parel, Mumbai, Maharashtra 400013, India"
g.m.kapadia & co,18.9310031,72.8330813,"Tamarind House, 36B Tamarind Lane, Fort, Kala Ghoda, Fort, Mumbai, Maharashtra 400001, India"
vitae international accounting services pvt.ltd.,19.0759837,72.8776559,"Mumbai, Maharashtra, India"
khandelwal jain & co.,18.5307936,73.8620939,"Level3, Riverside Business Bay Wellesley Road, near RTO, Sangamvadi, Pune, Maharashtra 411001, India"
radisson consulting llp,19.2185985,72.8641349,"A-005, Kanakia Western Edge II, Western Edge II, Off, Western Express Hwy, Food Corporation of India Warehouse, Borivali East, Mumbai, Maharashtra 400066, India"
mgb advisors private limited,19.0759837,72.8776559,"Mumbai, Maharashtra, India"
rakchamps | chartered accountants,19.21114,72.8298209,"GF-9, H-Wing, Building No. 2, Rock Enclave, Next to SBI, Hindustan Naka, Kandivali west, Kandivali, Sahyadri Nagar, Kandivali West, Mumbai, Maharashtra 400067, India"
desai saksena & associates,18.934291,72.83420699999999,"First Floor, Laxmi Building, Sir Phirozshah Mehta Rd, Borabazar Precinct, Ballard Estate, Fort, Mumbai, Maharashtra 400001, India"
"p c ghadiali and co llp, chartered accountants",18.9730605,72.81369339999999,"Arun Chamber, XRF7+6FG, Tardeo Main Road, Janata Nagar, Tardeo, Mumbai, Maharashtra 400034, India"
taxpert professionals,19.0799167,72.89579669999999,"725-726, 7th Floor, D- Wing, Neelkanth Business Park, near Bus Depot, Sadguru Nagar, Neelkanth Kingdom, Vidyavihar West, Vidyavihar, Mumbai, Maharashtra 400086, India"
apmh & associates llp,45.64037090000001,-122.6666073,"2600 F St, Vancouver, WA 98663, USA"
themis consult,19.0151109,72.8512053,"42A, G D Ambekar Rd, Central Railway Colony, Kohinoor Mill, Wadala, Mumbai, Maharashtra 400031, India"
somaiya & co.,19.073679,72.8991746,"Vidyanagar, Vidya Vihar East, Vidyavihar, Mumbai, Maharashtra 400077, India"
janaswamy associates,19.044434,72.864887,"B-603 , Sion, Maryland Corner, 39, T.V. Chidambaram marg, Air Force Quarters, Sion East, Sion, Mumbai, Maharashtra 400022, India"
agarwal sanganeria & co. (chartered accountants),18.9276724,72.8330985,"219, Old Bake House, Maharashtra Chamber, Of Commerce Lane, Lion Gate, Fort, Mumbai, Maharashtra 400023, India"
ratna international,18.9351674,72.8340839,"35 ate a Terrace 1st Floor, Crossing Road, Borabazar Precinct, Azad Maidan, Fort, Mumbai, Maharashtra 400001, India"
apurva group,19.1111771,72.9088501,"7/F, B Wing, Supreme Business Park, South Avenue Street, Hiranandani Gardens, Powai, Hiranandani Gardens, Powai, Mumbai, Maharashtra 400076, India"
mahavir industries,18.9933579,72.827167,"Mahavir Industries Building, Sun Mill Compound, next to Parvati Industrial Estate, Lower Parel West, Lower Parel, Mumbai, Maharashtra 400013, India"
arkema chemicals india private limited,19.0495077,73.02302879999999,"D-43(1&5, Thane - Belapur Rd, Shivaji Nagar, MIDC Industrial Area, Shiravane, Nerul, Navi Mumbai, Maharashtra 400706, India"
chempro expertise private limited,19.1032148,72.8879978,"203, Trade Corner Near Sakinaka, Metro, Bandi Bazaar, Nair Wadi, Andheri East, Mumbai, Maharashtra 400072, India"
sharp engineering,19.111449,72.850487,"2, Ramprasad Yadav Compound, Lane Number 1, near Jain Dairy, Koldongri, Andheri East, Mumbai, Maharashtra 400069, India"
cerebrus consulting,19.0926361,72.9128309,"222, Lal Bahadur Shastri Rd, Nityanand Nagar, Ghatkopar West, Mumbai, Maharashtra 400086, India"
jet airways,19.0759837,72.8776559,"Mumbai, Maharashtra, India"
air india sats,19.0759837,72.8776559,"Mumbai, Maharashtra, India"
riya travel and tours india pvt ltd,19.0759837,72.8776559,"Mumbai, Maharashtra, India"
goair,19.0931403,72.8567534,"Chhatrapati Shivaji Maharaj International Airport, T1, Navpada, Vile Parle East, Vile Parle, Mumbai, Maharashtra 400099, India"
cambata aviation pvt ltd,19.095225,72.8324386,"No 3A, Hangar, Juhu Aerodrome, Vile Parle West, Airport Area, Juhu, Mumbai, Maharashtra 400054, India"
sheorey digital systems ltd. (sds),18.9440634,72.8240965,"Tarabai Hall, 1st floor, 97, Marine Drive Shiv Prasad, Marine Lines, Churchgate, Mumbai, Maharashtra 400002, India"
celebi nas airport services india pvt. ltd.,19.1076102,72.8798779,"WING-B, Sir Mathuradas Vasanji Rd, Chimatpada, Marol, Andheri East, Mumbai, Maharashtra 400059, India"
mumbai international airport pvt. ltd.,19.0759837,72.8776559,"Mumbai, Maharashtra, India"
gvk mial,19.0925301,72.8562749,"Chhatrapati Shivaji International Airport Area, 3VV4+2G6, Navpada, Vile Parle East, Vile Parle, Mumbai, Maharashtra 400099, India"
indamer aviation pvt. ltd.,19.0953418,72.837144,"3RWP+4VJ, Airport Area, Juhu, Mumbai, Maharashtra 400049, India"
millennium aero dynamics private limited,18.9643445,72.8056855,"36A/37 , White Hall , 143, August Kranti Marg Kemps Corner, Kemps Corner, Malabar Hill, Mumbai, Maharashtra 400006, India"
comfort travel group,19.0759837,72.8776559,"Mumbai, Maharashtra, India"
rodeo drive,19.1097338,72.87594779999999,"Peninsula redpine, HOTEL, Bori Colony, Marol, Andheri East, Mumbai, Maharashtra 400059, India"
epsilon aerospace pvt ltd,19.138486,73.015621,"R-523, Rd Number 20, T.T.C. Industrial Area, MIDC Industrial Area, Rabale, Navi Mumbai, Maharashtra 400701, India"
kris aero services pvt ltd,19.0759837,72.8776559,"Mumbai, Maharashtra, India"
invision air services pvt. ltd.,18.9242079,72.82260649999999,"602, 5, Jamnalal Bajaj Marg, Nariman Point, Mumbai, Maharashtra 400021, India"
cav aero services llp,19.1118641,72.8790282,"402, Wellington Business Park 2, Gamdevi, Marol, Andheri East, Mumbai, Maharashtra 400059, India"
allied aviation pvt. ltd,19.1117312,72.8652334,"167, Guru Hargovindji Rd, Shaheed Bhagat Singh Society, S B Singh Colony, Chakala, Andheri East, Mumbai, Maharashtra 400093, India"
sydler group of companies,19.0946925,72.84879289999999,"Mittal Tower, C Wing, 115, 11th Floor, Nariman Point, Navpada, Vile Parle East, Vile Parle, Mumbai, Maharashtra 400021, India"
maximaa systems ltd.,19.0759837,72.8776559,"Mumbai, Maharashtra, India"
millennium herbal care limited,18.9273226,72.8220116,"12 B Nirmal, 241, 242, Backbay Reclamation, Nariman Point, Mumbai, Maharashtra 400021, India"
total herb solutions private limited,19.0759837,72.8776559,"Mumbai, Maharashtra, India"
maac,19.0759837,72.8776559,"Mumbai, Maharashtra, India"
maya digital studios (p) ltd.,19.168619,72.853304,"6th Floor, Chintamani Classique, Off, Aarey Rd, next to Vishveshwar Nagar, Churi Wadi, Goregaon, Mumbai, Maharashtra 400063, India"
88 pictures,19.1226261,72.8706223,"Plot No.C-8, opp. Rolta Technology Park, near Seepz, M.I.D.C, Subhash Nagar, Andheri East, Mumbai, Maharashtra 400093, India"
assemblage entertainment,19.1177736,72.8887567,"4th Floor, ICC Chambers, 2, Saki Vihar Rd, Muranjan Wadi, Marol, Powai, Mumbai, Maharashtra 400072, India"
digitales studios,19.0759837,72.8776559,"Mumbai, Maharashtra, India"
graphiti multimedia pvt ltd,19.18977,72.8401471,"5th Floor, Neo Corporate Plaza, Malad, Navy Colony, Kanchpada, Malad West, Mumbai, Maharashtra 400064, India"
golden robot animation pvt. ltd.,19.174342,72.8446203,"306, DLH Park, Dlh Park, Swami Vivekananda Rd, Malad, Sunder Nagar, Goregaon West, Mumbai, Maharashtra 400064, India"
zee institute of creative arts -zica,19.1367958,72.8347004,"Satyadev Plaza, 102 First Floor, Veera Desai Rd, Veera Desai Industrial Estate, Andheri West, Mumbai, Maharashtra 400053, India"
circle creation,19.1377913,72.832835,"1004,10th Floor Morya Bluemoon, New Link Rd, near tanishq showroom, Veera Desai Industrial Estate, Andheri West, Mumbai, Maharashtra 400053, India"
maac junior toon club,19.0638441,72.83702629999999,"Gharaonda, Gr. floor Plot # 558, 32nd Road, National College Lane, Bandra West, Mumbai, Maharashtra 400050, India"
frame picture studio,19.2765014,72.8570124,"6th Floor, 604, Sai Arpan Bldg, Mira Road East, near P.G Vora School, Shanti Vihar, Mira Road East, Mumbai, Maharashtra 401107, India"
bombay rayon fashions limited,19.0759837,72.8776559,"Mumbai, Maharashtra, India"
house of anita dongre limited(formerly known as and designs india ltd.),19.1475334,73.014522,"Plot No. R 1, 847, Cross Rd Number 5, T.T.C. Industrial Area, Sector 1, Rabale, Navi Mumbai, Maharashtra 400701, India"
future lifestyle fashions limited,18.9307062,72.8340314,"37, Mumbai Samachar Marg, Kala Ghoda, Fort, Mumbai, Maharashtra 400001, India"
etisalat db telecom pvt. ltd.,19.0759837,72.8776559,"Mumbai, Maharashtra, India"
texport syndicate india ltd,19.1086887,72.8789185,"CTS-796-A, Fleet House, Sir Mathuradas Vasanji Rd, opp. Marol Fire Station Building, Gamdevi, Marol, Andheri East, Mumbai, Maharashtra 400059, India"
texport industries pvt. ltd.,19.1148273,72.8500291,"506, Hubtown Solaris, Professor NS Phadke Rd, Vijay Nagar, Andheri East, Mumbai, Maharashtra 400069, India"
spykar lifestyles pvt ltd,19.1700995,72.8570404,"Near Virwani Industrial Estate ,, 1st /2nd Floor, 271, Business Park Ind. Bldg,Goregoan East, Vishveshwar Nagar, Goregaon West, Mumbai, Maharashtra 400063, India"
zodiac clothing company ltd,19.0759837,72.8776559,"Mumbai, Maharashtra, India"
bewakoof.com,19.0759837,72.8776559,"Mumbai, Maharashtra, India"
tresor,19.2104075,72.8752039,"1, Evershine Rd, Evershine Phase 3, Evershine Millennium Paradise, Thakur Village, Kandivali East, Mumbai, Maharashtra 400101, India"
flyrobe,19.0759837,72.8776559,"Mumbai, Maharashtra, India"
catwalk worldwide pvt. ltd.,19.1788627,72.836637,"No 13/L, New Link Rd, Malad, Reserve Bank of India Staff Quarters, Mindspace, Malad West, Mumbai, Maharashtra 400064, India"
mirraw.com,19.0759837,72.8776559,"Mumbai, Maharashtra, India"
central - future lifestyle fashion limited,19.2633036,72.8748219,"Ketkipada, Dahisar East, Mumbai, Maharashtra 400068, India"
the souled store pvt. ltd.,18.9882605,72.8275692,"224, Tantia Jogani Industrial Premises Opp Lodha Excelus, Jivraj Ramji Boricha Marg, Lower Parel East, Shastri Nagar, Adarsh Nagar, Worli, Mumbai, Maharashtra 400011, India"
melange,18.9644923,72.8085634,"33, Altamount Rd, Kemps Corner, Tardeo, Mumbai, Maharashtra 400026, India"
krishna beads industries (kbi),18.9942425,72.8280073,"A1, 1st Floor , Unit 150, Shah & Nahar Industrial Estate, Sitaram Jadhav Marg, Lower Parel, Mumbai, Maharashtra 400013, India"
stylecracker,19.0151206,72.8512995,"42A Impression House, G D Ambekar Marg,, Wadala Village, Wadala(west), Sahakar Nagar, Wadala, Mumbai, Maharashtra 400031, India"
pepe jeans india ltd,19.1080069,72.8837132,"3rd Floor ,C-Tower, Times Square Building, Andheri - Kurla Rd, Gamdevi, Marol, Andheri East, Mumbai, Maharashtra 400059, India"
eternity lifestyles pvt. ltd,19.042027,72.86710099999999,"129, Champaklal Udyog Bhavan, 105, Sion East, Air Force Quarters, Sion East, Sion, Mumbai, Maharashtra 400022, India"
manish malhotra,19.0738661,72.8338069,"Shivraj Heights, Corner of 14th Road & Linking Road, Khar West, Santacruz West, Mumbai, Maharashtra 400052, India"
sapl industries private limited,18.9948925,72.8255124,"5th Floor, The Phoenix House, Phoenix Mills Compound, Lower Parel, Mumbai, Maharashtra 400013, India"
bombay shirt company,19.0759837,72.8776559,"Mumbai, Maharashtra, India"
purple style labs,19.086778,72.8269687,"1st Floor, 30B, High Tide, Juhu Tara Rd, Chandrabai Nagar, Juhu, Mumbai, Maharashtra 400049, India"
marsil exports,18.972502,72.81410000000001,"2/02, 2nd Floor, Tardeo A C Market, Tardeo Road, Tardeo Road, Janata Nagar, Tardeo, Mumbai, Maharashtra 400034, India"
emmar international,18.9255728,72.8242221,"613, Raheja Centtre, 214, Nariman Point, Nariman Point, Mumbai, Maharashtra 400021, India"
alex jewellery pvt. ltd.,19.204741,72.8261955,"74/A, Charkop Rd, Kandivali, Charkop, Charkop Industrial Estate, Kandivali West, Mumbai, Maharashtra 400067, India"
coutloot,19.1717457,72.83293669999999,"Prism Tower, behind HyperCITY, Malad, Goregaon West, Mumbai, Maharashtra 400064, India"
federal brands limited,19.0759837,72.8776559,"Mumbai, Maharashtra, India"
textilepeople,19.1627629,72.8328758,"C/803, Orion Off, Vasant Galaxy, New Link Rd, Jai Taramani CHS, Laxmi Nagar, Goregaon West, Mumbai, Maharashtra 400104, India"
art group,19.187177,72.840777,"Unit No. 1, Satguru Krupa, Building, Haji Zakeria Rd, Malad, Navy Colony, Liberty Garden, Malad West, Mumbai, Maharashtra 400064, India"
wow retail pvt.ltd,19.181663,72.835893,"924, Ijmima Complex, Link Road, Malad West, behind Goregaon Sports Club, Malad, Mindspace, Malad West, Mumbai, Maharashtra 400064, India"
karwa marketing,19.0759837,72.8776559,"Mumbai, Maharashtra, India"
mineral fashions pvt ltd.,19.2029595,72.9654492,"S-21, Korum Mall, Opposite Eastern Express Highway Near Cadbury Compound, Mangal Panday Road, Samata Nagar, Thane West, Thane, Maharashtra 400606, India"
bombay electric,18.9211403,72.8325667,"1, BEST Marg, Apollo Bandar, Colaba, Mumbai, Maharashtra 400001, India"
flemingo dutyfree shop private limited,19.0759837,72.8776559,"Mumbai, Maharashtra, India"
kotak overseas private limited,19.0461723,72.90981339999999,"10, Mahinder Chambers,, Waman Tukaram Patil Marg, opp. Dukes Factory, MBPT Colony, Best Colony, Chembur, Mumbai, Maharashtra 400071, India"
tip top fashions private limited,19.1843654,72.8465415,"307, 3rd Floor, Station Center, Swami Vivekananda Rd, Malad, Navy Colony, Mamledarwadi, Malad West, Mumbai, Maharashtra 400064, India"
anika apparels pvt ltd,18.994625,72.8272405,"180/A, 400013, Lower Parel, Mumbai, Maharashtra 400013, India"
texorange corporation limited,19.104923,72.882432,"160/6, Mittal Industrial Estate, Andheri Kurla Road,, Marol Naka, Andheri (E), Mittal Industrial Estate, Marol, Saki Naka, Mumbai, Maharashtra 400059, India"
blue blends india ltd (blb),18.951727,72.83108849999999,"2nd Floor, J. B. F House, Kalbadevi, Mumbai - 400002, Chippi Chawl, Kalbadevi, Mumbai, Maharashtra 400002, India"
avon lifestyle products pvt. ltd.,19.12034,72.861158,"B1, Nandkishore Industrial Estate, Off Mahakali Caves Rd, near Paper Box Industrial Estate, Gundavali, Andheri East, Mumbai, Maharashtra 400093, India"
s. kumars nationwide limited,19.0759837,72.8776559,"Mumbai, Maharashtra, India"
edifice architects pvt. ltd.,19.0470031,72.9106048,"First Floor Plot #2A Ujagar Infotech Park Opposite Deonar Bus Depot Sunder Baug, MBPT Colony, Best Colony, Govandi East, Mumbai, Maharashtra 400088, India"
vector projects (i) pvt. ltd,19.0759837,72.8776559,"Mumbai, Maharashtra, India"
udc,18.9223746,72.8319078,"301, Ram Nimi Building, Mandlik Rd, Apollo Bandar, Colaba, Mumbai, Maharashtra 400001, India"
anj group,19.199949,72.82760999999999,"106/107, Rajiv Gandhi Commercial Complex, Kandivali, Chatrapati Shivaji Raje Complex, Kandivali West, Mumbai, Maharashtra 400067, India"
architect hafeez contractor,18.9303354,72.8349009,"29 Bankstreet, 1st Floor, Sonawala Building, Horniman Circle, G Vaidya Rd, Kala Ghoda, Fort, Mumbai, Maharashtra 400023, India"
dsp design associates pvt. ltd.,18.989203,72.813428,"6th Floor, Dev Chand House Dr, Worli Hill Rd, Shiv Sagar Estate, Worli, Mumbai, Maharashtra 400018, India"
hunter douglas india pvt ltd,19.1120727,72.86055379999999,"661-662, 6th Floor, Building No 6, Solitaire Corporate Park Andheri Ghatkopar Link Road, Chakala, Andheri East, Mumbai, Maharashtra 400093, India"
ratan j batliboi architects,18.999497,72.82346849999999,"Industrial Estate, 346 A to Z, Ganpatrao Kadam Marg, near Peninsula Park, Lower Parel West, Lower Parel, Mumbai, Maharashtra 400013, India"
broadband pacenet (india) pvt. ltd.,19.1175443,72.867693,"B8, Marol Industrial Area, Next to MMIDC Police Station, Andheri East, Mulgaon, Andheri East, Mumbai, Maharashtra 400093, India"
npapl,19.0620473,72.83473599999999,"204, Silver Pearl Building, Waterfield Road, Bandra West, Mumbai, Maharashtra 400050, India"
sankalpan infrastructure pvt. ltd.,19.1916617,72.9563943,"Road Number 9, Wagle Estate Rd, Raghunath Nagar, Padwal Nagar, Thane West, Thane, Maharashtra 400080, India"
p g patki architects,18.9318794,72.8329706,"1st Floor, Calcot House, 8, Tamarind Lane, Fort, Kala Ghoda, Fort, Mumbai, Maharashtra 400001, India"
worksphere architects india pvt.ltd.,19.1599147,72.94651979999999,"Mulund - Goregaon Link Rd, Nahur, Industrial Area, Bhandup West, Mumbai, Maharashtra 400078, India"
m/s arnita sez consultants pvt. ltd.,19.1175646,72.883584,"E-1105/06, Lok Sarita, Military Rd, Sankara Nagar, Bhavani Nagar, Marol, Andheri (E, Mumbai, Maharashtra 400059, India"
transitions architects pvt ltd,19.134625,72.8369171,"504,D Wing, Remi Bizcourt, Veera Desai Rd, Industrial Area, Andheri West, Mumbai, Maharashtra 400053, India"
team one architects (india) pvt. ltd.,19.0628277,72.8639084,"Plot No 25, Laxmi Tower, B Wing, Unit No 3B, Second St., G Block, G Block BKC, Bandra Kurla Complex, Bandra East, Mumbai, Maharashtra 400051, India"
zz architects,19.0033503,72.82722700000001,"8th Floor, Trade Link, 'E' Wing, 'B' Block Kamala Mill Compound, Senapati Bapat Marg, Lower Parel, W, Maharashtra 400013, India"
synectics forum,19.0759837,72.8776559,"Mumbai, Maharashtra, India"
kns architects pvt ltd,19.174639,72.837531,"16, Muncipal Shopping Center, Mitha Nagar, Link Road, Goregaon West, Goregaon West, Malad, Sunder Nagar, Malad West, Mumbai, Maharashtra 400174, India"
kapadia associates design llp,18.995782,72.83853200000001,"112, peninsula Centre, Dr SS Rao road, parel East, Parel East, Parel, Mumbai, Maharashtra 400012, India"
mno,19.1392287,72.8114927,"MNO, Cluster_mumbai Suburban_705, Amit Nagar, Versova, Andheri West, Mumbai, Maharashtra 400061, India"
nestopia,18.9614047,72.8293927,"61, Chimna Butcher St, Ajmer, Kumbharwada, Mumbai, Maharashtra 400003, India"
jtcpl designs,19.010393,72.829892,"3rd floor Sadguru Darshan, 1050, New Prabhadevi Rd, Prabhadevi, Mumbai, Maharashtra 400025, India"
unit 7 group,18.9381752,72.8355754,"Waziri Manzil 16 Manohardas Road, Modi St, Borabazar Precinct, Ballard Estate, Fort, Mumbai, Maharashtra 400001, India"
brindavan group,19.0511466,72.8676486,"Vrindavan, Chunabhatti, Sion, Mumbai, Maharashtra 400022, India"
"vpcpl - vijay punjabi consultants pvt. ltd.,",18.9249028,72.8217243,"Ajanta Apartments, Jamnalal Bajaj Marg, Mahatma Phule Nagar, Nariman Point, Mumbai, Maharashtra 400021, India"
ga design,18.9942866,72.8271888,"Adhyaru Industrial Estate, Sun Mill Compound, 208, Lower Parel West, Lower Parel, Mumbai, Maharashtra 400013, India"
practice design pvt ltd,19.050241,72.9180421,"204, Sai Samarth Business Park, Deonar Village Rd, Deonar, Govandi East, Mumbai, Maharashtra 400088, India"
somaya and kalappa consultants (snk),18.935455,72.841415,"Ground Floor, Udyog Bhavan, 29, Walchand Hirachand Marg, Ballard Estate, Fort, Mumbai, Maharashtra 400001, India"
the ashleys,19.0933328,72.91440399999999,"315, Goldcrest Business Park, Lal Bahadur Shastri Rd, opp. Vijay Sales, Nityanand Nagar, Ghatkopar West, Mumbai, Maharashtra 400086, India"
talati and panthaky associated - india,19.0759837,72.8776559,"Mumbai, Maharashtra, India"
collage design pvt. ltd.,19.1104174,72.9299611,"300, Sai Sampann, Station Rd, Kala Ghoda, Vikhroli, Mumbai, Maharashtra 400083, India"
green space alliance,19.1122719,72.8827768,"702, Makwana Rd, Gamdevi, Marol, Andheri East, Mumbai, Maharashtra 400059, India"
m m projects consultants private limited,19.0759837,72.8776559,"Mumbai, Maharashtra, India"
b.n. shah & associates,19.012817,72.8483668,"316, Wadala Udyog Bhavan, Naigaon Cross Rd, Wadala East, Naigaon, Dadar, Mumbai, Maharashtra 400031, India"
abm architects mumbai,19.0243658,72.835413,"665, SVS Rd, next to Hotel Amigo, Dadar West, Prabhadevi, Mumbai, Maharashtra 400028, India"
saral vaastu,19.0759837,72.8776559,"Mumbai, Maharashtra, India"
beautex industries pvt ltd,18.9931437,72.8268781,"Office#6, Ground Floor, Parvati Industrial Premises, Sun Mill Compound, Lower Parel, Mumbai, Maharashtra 400013, India"
studio mumbai architects,18.981631,72.832219,"561, 563, NM Joshi Marg, Byculla West, Jacob Circle, Mumbai, Maharashtra 400011, India"
trescent lifestyles pvt ltd,19.0082821,72.8208377,"324, T.V Industrial Estate, behind Glaxo Labs, Worli, Mumbai, Maharashtra 400030, India"
crysta l mirage pvt. ltd.,19.204964,72.8256816,"73/D, Government Industrial Estate, Charkop, Kandivali West, Ganesh Nagar, Bhandup West, Kandivali, Charkop, Charkop Industrial Estate, Kandivali West, Mumbai, Maharashtra 400067, India"
store indya private limited,19.0759837,72.8776559,"Mumbai, Maharashtra, India"
baroque,19.0759837,72.8776559,"Mumbai, Maharashtra, India"
kyoorius communications pvt ltd,18.9930393,72.82629659999999,"Second Floor, Kohinoor Estate, 165, Sun Mills Compound Rd, Lower Parel, Mumbai, Maharashtra 400013, India"
baaya design,18.9924072,72.8242628,"A-Wing, Ground Floor, Prathamesh Tower, Raghuvanshi Mills, Senapati Bapat, Road, Gandhi Nagar, Lower Parel West, Worli, Mumbai, Maharashtra 400013, India"
volkswagen india,19.0759837,72.8776559,"Mumbai, Maharashtra, India"
asia motor works,19.0555995,72.8994237,"25, Shantabai Ambre Marg, Chembur, Mumbai, Maharashtra 400071, India"
"mahindra and mahindra limited [automotive, farm equipment and agri business]",19.0759837,72.8776559,"Mumbai, Maharashtra, India"
nrb bearings ltd.,18.9341437,72.8348489,"Dhannur, 15, Sir Phirozshah Mehta Rd, Borabazar Precinct, Ballard Estate, Fort, Mumbai, Maharashtra 400001, India"
carwale,19.0759837,72.8776559,"Mumbai, Maharashtra, India"
mahindra two wheelers ltd,19.1459426,72.9366873,"shop 19, Sai Ashish Building, Bhandup Village Rd, opp. GS shetty school, Bhandup West, Mumbai, Maharashtra 400078, India"
bkt tires,19.0759837,72.8776559,"Mumbai, Maharashtra, India"
automotive manufacturers private limited,19.0717526,72.88415479999999,"No. 108, Bazar Ward Rd, Vinobha Bhave Nagar, Kurla West, Kurla, Mumbai, Maharashtra 400070, India"
mahindra first choice services ltd.,19.0759837,72.8776559,"Mumbai, Maharashtra, India"
cartrade.com,19.0130137,72.82658839999999,"Lloyds Centre Point 1st Floor, Above Tata Motors Showroom Unit No. 11 & 12, 1096A, Appasaheb Marathe Marg, Century Bazaar, Prabhadevi, Mumbai, Maharashtra 400025, India"
sedemac mechatronics,19.0759837,72.8776559,"Mumbai, Maharashtra, India"
mahindra first choice wheels ltd,19.0759837,72.8776559,"Mumbai, Maharashtra, India"
asian ppg industries limited,19.0759837,72.8776559,"Mumbai, Maharashtra, India"
audi india,19.0759837,72.8776559,"Mumbai, Maharashtra, India"
setco,18.9748314,72.8128685,"54/A, Tardeo Rd, near Film Center Building, Malviya Nagar, Tardeo, Mumbai, Maharashtra 400034, India"
abc bearings ltd,18.9911464,72.81357249999999,"402 - B, Poonam Chambers, Dr. A. B. Road, Worli, Markandeshwar Nagar, Shiv Sagar Estate, Worli, Mumbai, Maharashtra 400018, India"
credr,19.0759837,72.8776559,"Mumbai, Maharashtra, India"
classic stripes pvt. ltd.,19.11024,72.8809522,"Astarc, House, 76, 79, Makwana Rd, Gamdevi, Marol, Andheri East, Andheri, Maharashtra 400059, India"
supreme group company,19.0592912,72.9012796,"Plot 110, 16th Rd, arg, Chembur, Mumbai, Maharashtra 400071, India"
mahindra sona limited,18.9252366,72.8236649,"31, 3rd Floor, Maker Chambers VI, Nariman Point, Nariman Point, Mumbai, Maharashtra 400021, India"
infinity cars pvt ltd,19.0615172,72.83658799999999,"No 253, 30th Rd, Bandra West, Mumbai, Maharashtra 400050, India"
iit bombay racing,19.0759837,72.8776559,"Mumbai, Maharashtra, India"
shivam autozone (india) pvt. ltd,19.0759837,72.8776559,"Mumbai, Maharashtra, India"
delux bearings pvt. ltd.,19.000597,72.829404,"Shop No.31/A, 32, Mathuradas Mill Compound, Ideal Industrial Estate, Lower Parel Bridge, NM Joshi Marg, Senapati Bapat Marg, Lower Parel, Mumbai, Maharashtra 400013, India"
spectra motors ltd,19.0759837,72.8776559,"Mumbai, Maharashtra, India"
orion racing india,19.07301,72.899591,"3VFX+6R4, Ghatkopar - Mahul Rd, Vidyanagar, Vidya Vihar East, Vidyavihar, Mumbai, Maharashtra 400077, India"
remsons industries ltd,19.103525,72.8485883,"401, Gladdiola, above Kotak Mahindra Bank, Near Tilak School, E, Hanuman Rd, Vishnu Prasad Society, Navpada, Vile Parle East, Vile Parle, Mumbai, Maharashtra 400057, India"
excell autovista pvt ltd,19.1427555,72.8430534,"3987, Swami Vivekananda Rd, कांदिवली पश्चिम, Parekh Nagar, Jogeshwari West, Mumbai, Maharashtra 400047, India"
group shaman,19.0759837,72.8776559,"Mumbai, Maharashtra, India"
mansons international pvt. ltd.,19.0759837,72.8776559,"Mumbai, Maharashtra, India"
gen next motors ltd.,19.0807842,73.0046023,"19, Palm Beach Rd, Juhu Nagar, Sector 19C, Palm Beach, Vashi, Navi Mumbai, Maharashtra 400703, India"
carcrew,19.0759837,72.8776559,"Mumbai, Maharashtra, India"
linkway honda,19.1133051,72.88804809999999,"35, Saki Vihar Rd, Saki Vihar, Budhia Jadhav Wadi, Marol, Andheri East, Mumbai, Maharashtra 400072, India"
ad design,19.0429459,72.8571719,"Room no. 384, 90 Feet Rd, near samiyana hotel, Kuttiwadi, Transit Camp, Rajiv Gandhi Nagar, Dharavi, Mumbai, Maharashtra 400017, India"
mynewcar india,19.1485249,72.8328908,"39, Oshiwara Police Station Rd, Oshiwara, Jogeshwari West, Mumbai, Maharashtra 400053, India"
kamal motors (ailsinghani group),19.1081795,72.8586674,"13NX, Abbas Manzil, Chakala Rd, opposite Hotel Ratna Mahal, Parshiwada, Chakala, Andheri East, Mumbai, Maharashtra 400099, India"
g3 motors ltd,19.108021,73.004007,"238/A, Sector 2, Kopar Khairane, Navi Mumbai, Maharashtra 400709, India"
