Name,latitude,longitude,Address
just another show,19.098026,72.8847773,"404, A wing, Trade Square 1, Mehra compound, Near DSK Madhuban, complex, Andheri - Kurla Rd, Safed Pul, Saki Naka, Mumbai, Maharashtra 400072, India"
robust events llp,19.0855906,72.8887936,"UGB 35, Phoenix Paragon Plaza, Kamani, Kurla West, Kurla, Mumbai, Maharashtra 400070, India"
tata group,19.0759837,72.8776559,"Mumbai, Maharashtra, India"
dbs office business centers,18.9239238,72.8241067,"TULSIANI CHAMBERS, GROUND FLOOR, SHOP NO, 13, Free Press Journal Marg, Nariman Point, Mumbai, Maharashtra 400021, India"
reliance money express ltd.,19.0759837,72.8776559,"Mumbai, Maharashtra, India"
viztar international,19.015249,73.0375112,"5th floor, A wing Plot No 62, Agrawal Trade Centre, Sakal Bhavan Rd, Shahbaz Village, Sector 11, CBD Belapur, Navi Mumbai, Maharashtra 400614, India"
k. girdharlal international limited,19.0651413,72.8646128,"EC- 9011/12 Bharat Diamond Bourse Internal Rd, 400051, G Block BKC, Bandra Kurla Complex, Bandra East, Mumbai, Maharashtra 400051, India"
hinduja group limited,18.9873508,72.81419989999999,"HINDUJA HOUSE, 171, Dr Annie Besant Rd, लोटस कॉलनी, वरळी, मुंबई, महाराष्ट्र 400018, India"
drishti group,19.2013895,72.8474304,"Shop No. A2-A4, Aashiana, Opp Usha Maternity Home,, Shantilal Modi Rd, below Nakoda Bhairav Foundation | Charitable Trust Kandivali | Home Visit for Blood Test | Sonography, Dental Clinic, U Lipo Centre, Kandivali, Bhagat Colony, Kandivali West, Mumbai, Maharashtra 400067, India"
speedfam india pvt ltd,19.1439821,73.0157261,"W-401, Ttc Industrial Area, M I D C Rabale, Ttc Industrial Area, Rabale, Mumbai, Maharashtra 400701, India"
iss integrated facility services pvt. ltd.,19.054982,72.88642999999999,"no. 4, Eastern Express Hwy, Swastik Park, Vikhroli, Mumbai, Maharashtra 400071, India"
the federal bank limited,19.219679,72.85255099999999,"Sumer Nagar Building no.1, Shastri Nagar, Sumer Nagar, Borivali, Mumbai, Maharashtra 400092, India"
shipping job,19.0759837,72.8776559,"Mumbai, Maharashtra, India"
logicash solutions pvt ltd,19.1618098,72.85705159999999,"Mumbai, 5V64+PRF, Jay Prakash Nagar, Goregaon, Mumbai, Maharashtra 400063, India"
imaginarium (india) pvt ltd,19.1192479,72.8758261,"The Great Oasis, Plot No: D-13, 7th Floor, MIDC, Marol Industrial Area, Andheri East, Shree Krishna Nagar, Pandit Dindayala Upadhaya Nagar, Andheri East, Mumbai, Maharashtra 400093, India"
psipl [property solutions (india) pvt. ltd.],19.1122298,72.8716221,"Kalpataru Square, Kondivita Lane, Next to Hotel Vits (Hotel Lotus Suites), Off. Andheri Kurla Road, Andheri (East), Mumbai - 400059, RK Mandir Rd, Bhim Nagar, Andheri East, Mumbai, Maharashtra 400069, India"
castech group,19.0759837,72.8776559,"Mumbai, Maharashtra, India"
unify facility management pvt ltd.,19.1449641,72.8532599,"Lotus corporate park, F 502, Geetanjali Railway Colony, Laxmi Nagar, Goregaon, Mumbai, Maharashtra 400063, India"
acuserve integrated facilities pvt. ltd.,19.1202001,72.8761504,"414, Options Primo, Cross Road No. 21 MIDC, Andheri (E, near Passport Office, Shree Krishna Nagar, Marol MIDC Industry Estate, Andheri East, Mumbai, Maharashtra 400093, India"
frameworkz projects & management services pvt. ltd,19.187177,72.840777,"A713, Jaswanti Allied Business Center, Malad, Navy Colony, Liberty Garden, Malad West, Mumbai, Maharashtra 400064, India"
sunbeam facilities private limited,19.0759837,72.8776559,"Mumbai, Maharashtra, India"
pecopp pest control services,19.0759837,72.8776559,"Mumbai, Maharashtra, India"
manner and skill international pvt ltd,19.1463319,73.0080576,"R-102, 1st Floor, TTC Industrial Estate, MIDC Industrial Area, Rabale, Navi Mumbai, Maharashtra 400701, India"
godrej agrovet ltd,19.093875,72.922917,"3rd Floor, Godrej One, GODREJ ONE, Eastern Express Hwy, Pirojshanagar, Vikhroli, Mumbai, Maharashtra 400079, India"
ini farms,19.1138467,72.89283870000001,"A-102 Boomerang, Chandivali Farm Rd, Yadav Nagar, Chandivali, Andheri East, Mumbai, Maharashtra 400072, India"
c.g herbals,18.9922306,72.84543339999999,"424 Milan Industrial Estate, T.J Road Cotton Green, Jijamata Nagar, Abhyudaya Nagar, Parel, Mumbai, Maharashtra 400033, India"
swal corporation ltd,19.0773609,72.8473246,"2 Western Express Highway Teacher's Colony Bandra Kurla Complex, Chaitanya Nagar, Davri Nagar, Vakola, Bandra East, Mumbai, Maharashtra 400051, India"
bombay hemp company pvt ltd,18.9950207,72.82769720000002,"Unit #2, Cama Industrial Estate, Sun Mills Compound Rd, Lower Parel, Mumbai, Maharashtra 400013, India"
india infoline ltd,19.1527252,72.8324985,"Bhide Chok, Savedi Naka, 5R3J+3XX, Mhada Colony, Andheri West, Mumbai, Maharashtra 400047, India"
shriram transport finance co. ltd.,19.0846544,72.8836938,"Office no. 125 & 127 1st Floor A wing Sagar Tech Plaza. Andheri Kurla Road Near sakinaka metro station. Sakinaka, Bail Bajar, Andheri East, Mumbai, Maharashtra 400072, India"
angel broking,19.0759837,72.8776559,"Mumbai, Maharashtra, India"
citibank india,19.0759837,72.8776559,"Mumbai, Maharashtra, India"
hdfc,19.0759837,72.8776559,"Mumbai, Maharashtra, India"
indiabulls,19.0759837,72.8776559,"Mumbai, Maharashtra, India"
edelweiss financial services,19.0701893,72.8634098,"Edelweiss House, Windsor Ln, Kolivery Village, MMRDA Area, Kalina, Santacruz East, Mumbai, Maharashtra 400098, India"
crisil limited,19.1141826,72.8626199,"4V77+M2H, Sir Mathuradas Vasanji Rd, Hanuman Nagar, Andheri East, Mumbai, Maharashtra 400053, India"
sharekhan,19.0759837,72.8776559,"Mumbai, Maharashtra, India"
reliance capital,19.0759837,72.8776559,"Mumbai, Maharashtra, India"
motilal oswal financial services ltd,19.0759837,72.8776559,"Mumbai, Maharashtra, India"
tata capital,19.0759837,72.8776559,"Mumbai, Maharashtra, India"
dhfl,19.0759837,72.8776559,"Mumbai, Maharashtra, India"
fullerton india credit company ltd.,19.0759837,72.8776559,"Mumbai, Maharashtra, India"
capital first limited,19.229257,72.8536989,"Capital First Ltd., CAMS India Pvt. Limited Hirji Heritage, 4th floor office no, 402, Lokmanya Tilak Rd, Sundar Nagar, Borivali, Mumbai, Maharashtra 400092, India"
anand rathi securities,19.1044973,72.8395012,"Plot No 4, Swastik Society, Opposite Bhaidas Hall, N S Road, Vile Parle West, Navpada, Kamala Nagar, Vile Parle West, Mumbai, Maharashtra 400056, India"
bonanza portfolio ltd,19.0759837,72.8776559,"Mumbai, Maharashtra, India"
fino,19.0759837,72.8776559,"Mumbai, Maharashtra, India"
hdfc sales pvt ltd,18.9296328,72.8262663,"4th Floor, Wing - A, HDFC House BackBay Recl, 166, HT Parekh Marg, Churchgate, Mumbai, Maharashtra 400020, India"
jm financial,19.0759837,72.8776559,"Mumbai, Maharashtra, India"
national stock exchange of india limited,19.0759837,72.8776559,"Mumbai, Maharashtra, India"
iifl wealth management ltd,19.0042942,72.8275073,"Kamala City, Senapati Bapat Marg, Lower Parel West, Lower Parel, Mumbai, Maharashtra 400013, India"
nirmal bang,19.0759837,72.8776559,"Mumbai, Maharashtra, India"
hdfc amc,19.0759837,72.8776559,"Mumbai, Maharashtra, India"
axis securities limited,18.9296801,72.8333334,"1, Dalal St, Kala Ghoda, Fort, Mumbai, Maharashtra 400001, India"
aspire home finance corporation limited (ahfcl),19.0759837,72.8776559,"Mumbai, Maharashtra, India"
national payments corporation of india (npci),19.0759837,72.8776559,"Mumbai, Maharashtra, India"
sbi mutual fund,19.0759837,72.8776559,"Mumbai, Maharashtra, India"
reliance mutual fund,19.0759837,72.8776559,"Mumbai, Maharashtra, India"
e nxt - a tata enterprise,19.0759837,72.8776559,"Mumbai, Maharashtra, India"
icra,19.0124113,72.8251964,"3rd Floor, Electric Mansion Appasaheb Marathe Marg, Prabhadevi, Century Bazaar, Prabhadevi, Mumbai, Maharashtra 400025, India"
stock holding corporation of india limited,19.0759837,72.8776559,"Mumbai, Maharashtra, India"
uti mf,19.0759837,72.8776559,"Mumbai, Maharashtra, India"
emkay global financial services ltd,19.1298304,72.8225002,"No. 10, JP Rd, Gharkul Society, Ratan Nagar, Seven Bunglow, Andheri West, Mumbai, Maharashtra 400053, India"
way2wealth brokers pvt. ltd.,18.9337168,72.8351222,"Buona Cassa Building, 6/2, Buona Casa 1st Floor, Sir P.M. Road, Homji St, Kala Ghoda, Fort, Mumbai, Maharashtra 400001, India"
franklin templeton india,19.0096828,72.8355732,"Indiabulls Finance Centre, Tower 2 12th & 13th Floor, Senapati Bapat Marg, Elphinstone (W), Babasaheb Ambedkar Nagar, Mumbai, Maharashtra 400013, India"
birla sun life asset management company limited (bslamcl),19.11582,72.8546015,"Western Express Highway, Andheri East, Scindia Society, Bima Nagar, Andheri East, Mumbai, Maharashtra 400069, India"
destimoney securities pvt. ltd,19.0759837,72.8776559,"Mumbai, Maharashtra, India"
prizm payment services pvt ltd,19.1455994,72.8552814,"No. 401, 4th Floor, Jai Coach Compound, Silver Metropolis, Off, Western Express Hwy, NESCO, Goregaon, Mumbai, Maharashtra 400063, India"
credila - an hdfc ltd company,19.0759837,72.8776559,"Mumbai, Maharashtra, India"
idbi capital,18.9152459,72.817067,"IDBI TOWER, 6th Floor, WTC, Cuffe Parade, Mumbai, Maharashtra 400005, India"
dsp blackrock mutual fund,19.0759837,72.8776559,"Mumbai, Maharashtra, India"
shriram housing finance ltd.,19.116236,72.8694127,"No 39/5 & 5a, Kondivita, Andheri East, Navi Mumbai, Maharashtra 400703, India"
orix auto infrastructure services limited,19.1106416,72.88350369999999,"Plot No. 94, Marol Cooperative Industrial Estate, Andheri - Kurla Rd, Gamdevi, Marol, Andheri East, Mumbai, Maharashtra 400059, India"
prabhudas lilladher,19.0053543,72.82260649999999,"3rd Floor, Sadhana House, 570, P. B. Marg, Behind Mahindra Tower, BDD Chawls Worli, Worli, Mumbai, Maharashtra 400018, India"
ncdex,19.1331001,72.9280826,"1st Floor, Akruti Corporate Park, Lal Bahadur Shastri Rd, near G.E.Garden, MMRDA Colony, Ambedkar Nagar, Kanjurmarg West, Bhandup West, Mumbai, Maharashtra 400078, India"
willis towers watson india,19.0759837,72.8776559,"Mumbai, Maharashtra, India"
invesco asset management (india) private limited,18.994797,72.830814,"2101-A, A Wing, 21st Floor, Marathon Futurex, N. M. Joshi Marg, Lower Parel, Lower, BDD Chawl, Lower Parel, Mumbai, Maharashtra 400013, India"
darashaw,19.0759837,72.8776559,"Mumbai, Maharashtra, India"
reliance home finance ltd.,19.0759837,72.8776559,"Mumbai, Maharashtra, India"
national securities depository limited (nsdl),19.0759837,72.8776559,"Mumbai, Maharashtra, India"
axis mutual fund,19.2318006,72.8533832,"2nd floor, Ramdas Sutrale Marg, above ICICI Bank, Roshan Nagar, Borivali West, Mumbai, Maharashtra 400091, India"
sushil finance,19.0759837,72.8776559,"Mumbai, Maharashtra, India"
multi commodity exchange of india,19.118014,72.85708,"Exchange Square,Chakala, CTS No. 255, Suren Rd, Gundavali, Andheri East, Mumbai, Maharashtra 400093, India"
tata asset management ltd,19.0759837,72.8776559,"Mumbai, Maharashtra, India"
aadhar housing finance ltd.,19.1122159,72.86732479999999,"Unit No 802, Natraj Rustomjee Western Express Highway, &, Sir Mathuradas Vasanji Rd, J B Nagar, Andheri East, Mumbai, Maharashtra 400069, India"
pamac,19.0128441,72.8496579,"A 21 , Shriram Industrial Estate, 13, G.D. Ambekar Road, Wadala, Shriram Industrial estate, Sahakar Nagar, Wadala, Mumbai, Maharashtra 400031, India"
smera ratings limited,19.0759837,72.8776559,"Mumbai, Maharashtra, India"
mcx stock exchange ltd.,19.0759837,72.8776559,"Mumbai, Maharashtra, India"
india ratings & research - a fitch group company,20.593684,78.96288,India
karvy financial services ltd,19.0759837,72.8776559,"Mumbai, Maharashtra, India"
cmie,19.0759837,72.8776559,"Mumbai, Maharashtra, India"
capri global capital ltd.,18.9987815,72.82867379999999,"502, Tower – A, PENINSULA BUSINESS PARK TOWER, A, Senapati Bapat Marg, Lower Parel, Mumbai, Maharashtra 400013, India"
home first finance company (hffc),19.1132061,72.8654689,"511, Acme Plaza J B, Andheri - Kurla Road, Vijay Nagar Colony, J B Nagar, Andheri East, Vijay Nagar Colony, J B Nagar, Andheri East, Mumbai, Maharashtra 400059, India"
mswipe technologies pvt. ltd.,18.9946431,72.8309591,"Unit No : A – 2602, 26th Floor, Marathon Futurex, Mafatlal Mills Compound, NM Joshi Marg, BDD Chawl, Lower Parel, Mumbai, Maharashtra 400013, India"
andromeda sales and distribution pvt ltd,19.0706839,72.8643661,"158, Dani Corporate Park, CST Road, Kolivery Village, MMRDA Area, Kalina, Santacruz East, Mumbai, Maharashtra 400098, India"
fedbank financial services ltd,19.1148819,72.8612327,"A-Wing, Unit No: 511, Kanakia Wall Street, Andheri - Kurla Rd, Hanuman Nagar, Andheri East, Mumbai, Maharashtra 400093, India"
incred - borrow. with confidence.,19.0759837,72.8776559,"Mumbai, Maharashtra, India"
reliance commercial finance division of reliance capital ltd.,19.0025681,72.8287976,"7th Floor, B Wing, Trade World, Kamala Mills Compound, Senapati Bapat Marg, Lower Parel West, Lower Parel, Mumbai, Maharashtra 400013, India"
xl dynamics india pvt. ltd.,19.1084365,72.9246733,"Jaswanti Landmark, Lal Bahadur Shastri Rd, Godrej & Boyce Industry Estate, Vikhroli West, Mumbai, Maharashtra 400079, India"
batlivala & karani securities india pvt. ltd.,42.9411155,-71.4668252,"4 Hawthorne Dr, Bedford, NH 03110, USA"
ask group,19.0759837,72.8776559,"Mumbai, Maharashtra, India"
rbsa advisors,19.1127343,72.8611684,"Unit No. 1121, Building No. 11, 2nd Floor Solitaire Corporate Park, Andheri - Kurla Rd, Chakala, Andheri (E, Mumbai, Maharashtra 400093, India"
aditya birla money myuniverse,19.155349,72.85385099999999,"R Tech Park, 12th Floor, Nirlon Compound, Off, Western Express Hwy, Cama Industrial Estate, Goregaon, Mumbai, Maharashtra 400063, India"
neogrowth credit pvt. ltd. - sme business loans,18.997046,72.82708939999999,"841, Senapati Bapat Marg, Nagin Nagar Chawl, Lower Parel, Mumbai, Maharashtra 400013, India"
prudential global services private limited,19.1233127,72.87142109999999,"4VFC+8HF, MIDC Central Rd, Seepz, Andheri East, Mumbai, Maharashtra 400093, India"
timesofmoney,19.0759837,72.8776559,"Mumbai, Maharashtra, India"
gepl capital pvt ltd,19.0759837,72.8776559,"Mumbai, Maharashtra, India"
wall street finance limited,19.1708991,72.85849,"1, Western Express Hwy, Hanuman Tekdi, Western Express Hwy, Hanuman Tekdi, Goregaon, Mumbai, Maharashtra 400063, India"
suryoday microfinance private limited,19.0759837,72.8776559,"Mumbai, Maharashtra, India"
avanse financial services ltd.,19.1040166,72.8721107,"001 & 002 Fulcrum, A-Wing, Ground Floor, Sahar Road Next to Hyatt Regency, Ashok Nagar, Andheri East, Mumbai, Maharashtra 400099, India"
mangal keshav securities ltd,19.1283619,72.8296147,"4RHH+8RX, Indian Oil Nagar, D.N.Nagar, Andheri West, Mumbai, Maharashtra 400047, India"
writer safeguard private limited,19.106921,72.8832989,"1A, Sir Mathuradas Vasanji Rd, Bhavani Nagar, Marol, Andheri East, Mumbai, Maharashtra 400059, India"
ambit capital,19.0002958,72.8288843,"Ambit House, 449, Senapati Bapat Marg, Lower Parel, Mumbai, Maharashtra 400013, India"
choice international limited,19.0759837,72.8776559,"Mumbai, Maharashtra, India"
mumbai angels,18.9869691,72.8244876,"201 Turf Estate, Shakti Mills Ln, Lower Parel, Mumbai, Maharashtra 400013, India"
rubique,19.1104468,72.887073,"2nd Floor, B wing, Krislon House, Krishanlal Marwah Marg, Ganesh Nagar, Marol, Andheri East, Mumbai, Maharashtra 400072, India"
religare macquarie private wealth,19.0759837,72.8776559,"Mumbai, Maharashtra, India"
essel finance,19.012,72.82133499999999,"264-26, Dr Annie Besant Rd, Municipal Colony, Worli Shivaji Nagar, Worli, Mumbai, Maharashtra 400025, India"
dhfl pramerica asset managers pvt. ltd.,19.0759837,72.8776559,"Mumbai, Maharashtra, India"
transerv pvt. ltd,19.0759837,72.8776559,"Mumbai, Maharashtra, India"
trust capital services (india) pvt ltd,19.0759837,72.8776559,"Mumbai, Maharashtra, India"
indostar capital finance ltd.,19.0066354,72.83344629999999,"One Indiabulls Center, 20th Floor, Tower 2A, Jupiter Mills Compound, Senapati Bapat Marg, Saidham Nagar, Parel, Mumbai, Maharashtra 400013, India"
crif high mark,19.0704278,72.86406,"402, Sheil Estate 158, CST Road Kalina, Santacruz (E), Kolivery Village, MMRDA Area, Kalina, Santacruz East, Mumbai, Maharashtra 400098, India"
tickerplant ltd.,19.1176722,72.85631529999999,"39, Suren Rd, Chakala, Andheri East, Mumbai, Maharashtra 400093, India"
bp wealth pvt ltd,18.9320344,72.8329695,"4th Floor, Rustom Building, 29, Veer Nariman Rd, Kala Ghoda, Fort, Mumbai, Maharashtra 400001, India"
credit sudhaar,19.0759837,72.8776559,"Mumbai, Maharashtra, India"
lic mutual fund,18.932851,72.82717989999999,"Industrial Assurance Building, 4th Floor, Opposite Churchgate Station, Churchgate, Mumbai, Maharashtra 400020, India"
my mobile payments ltd.,19.1899363,72.84088899999999,"61, Ramchandra Lane, Liberty Garden, Malad, Navy Colony, Mamledarwadi, Malad West, Mumbai, Maharashtra 400064, India"
muthoot housing finance limited,19.1728609,72.9415322,"302 nirmal galaxy avior opp johnson & johnson ltd, P&T Staff Colony, Mulund West, Mumbai, Maharashtra 400080, India"
jhunjhunwalas,19.1254837,72.8625445,"Sher E Punjab, Sher E Punjab Colony, Andheri East, Mumbai, Maharashtra 400093, India"
zaggle prepaid ocean services pvt. ltd.,19.114173,72.89277,"Ground Floor, BOOMERANG BUILDING, B-1004, Yadav Nagar, Chandivali, Powai, Mumbai, Maharashtra 400072, India"
itzcash,19.0039793,72.8279452,"Top 14th Floor, Times Tower, Kamala City, Senapati Bapat Marg, Lower Parel, Lower Parel, Mumbai, Maharashtra 400013, India"
vastu housing finance corporation ltd.,18.9951169,72.8519814,"A Wing 203/204, Pvt Ltd, Navbharat Estate, Barrister Nath Pai Marg, Tilak Nagar, Sewri, Mumbai, Maharashtra 400015, India"
creditvidya,19.0698602,72.8383699,"6th Floor, Empresa Building, 2nd Road, Khar, Ram Krishna Nagar, Khar West, Mumbai, Maharashtra 400052, India"
blend financial services ltd,19.1138974,72.85992259999999,"4th Floor, C Wing, Pramukh Plaza, Cardinal Gracious Rd, Chakala, Andheri East, Mumbai, Maharashtra 400099, India"
india factoring and finance solutions private limited (a member of the fimbank group),19.0759837,72.8776559,"Mumbai, Maharashtra, India"
inditrade capital limited,18.9951166,72.8247983,"Fifth Floor, High Street Phoenix, Phoenix House, Senapati Bapat Marg, Lower Parel West, Lower Parel, Mumbai, Maharashtra 400013, India"
airpay payment services,19.0759837,72.8776559,"Mumbai, Maharashtra, India"
reliance securities,19.0759837,72.8776559,"Mumbai, Maharashtra, India"
micro housing finance corporation,19.100567,72.8505941,"Pushpak Apartments, Malviya Rd, Satsang CHSL, Navpada, Vile Parle East, Vile Parle, Mumbai, Maharashtra 400057, India"
volkswagen finance private limited,19.1130747,72.8600185,"3rd Floor, Wing-A, OIA HOUSE, Cardinal Gracious Rd, Chakala, Andheri East, Mumbai, Maharashtra 400099, India"
india transact services limited,19.0759837,72.8776559,"Mumbai, Maharashtra, India"
electronic payment and services (p) ltd.,19.1113219,72.90803609999999,"SUPREME BUSINESS PARK, हिरानंदानी गार्डन्स, पवई, मुंबई, महाराष्ट्र 400076, India"
indiabulls asset management,19.0759837,72.8776559,"Mumbai, Maharashtra, India"
flexiloans,19.006466,72.832618,"Tower-2, 7th Floor, ONE WORLD CENTER, South Annexe, 841, Senapati Bapat Marg, Saidham Nagar, Parel, Mumbai, Maharashtra 400013, India"
aptivaa consulting,19.1244884,72.8691309,"2, Cross Rd C, Subash Nagar, Seepz, Andheri East, Mumbai, Maharashtra 400093, India"
"brand capital, india",18.9415167,72.834285,"Times of India, Dadabhai Naoroji Road, Dhobi Talao, Chhatrapati Shivaji Terminus Area, Fort, Mumbai, Maharashtra 400001, India"
paymate,19.0846618,72.8378328,"111, A, Sundervilla, Next to Vijay Sales W S V Road, Santacruz, Mumbai, Hasmukh Nagar, Santacruz West, Mumbai, Maharashtra 400054, India"
vertex securities ltd,18.9245151,72.8215191,"403, Regent Chambers -400 021, Nariman Point, Mumbai, Maharashtra 400021, India"
svatantra microfinance pvt. ltd,19.0759837,72.8776559,"Mumbai, Maharashtra, India"
quantum mutual fund,19.0759837,72.8776559,"Mumbai, Maharashtra, India"
kotak mutual fund,19.0759837,72.8776559,"Mumbai, Maharashtra, India"
shcil services ltd,18.9874154,72.83582849999999,"61, Dr Baba Saheb Ambedkar Rd, Ghodapdeo, Byculla East, Parel, Mumbai, Maharashtra 400012, India"
swadhaar finserve pvt ltd,19.1452086,72.853155,"D-401, Lotus Corporate Park, Cts No.185/A, Graham Firth Steel Compound, Western Express Highway, Geetanjali Railway Colony, Laxmi Nagar, Jogeshwari East, Mumbai, Maharashtra 400063, India"
financial hospital,19.211172,72.873194,"Shop no. 03, Ground floor, EMP-48, Building No. 06, D-Wing, Halley Tower,, Near Thakur Cinema,, Gokul Towers Road, Evershine Millennium Paradise, Thakur Village, Kandivali East, Kandivali, Evershine Millennium Paradise, Thakur Village, Kandivali East, Mumbai, Maharashtra 400101, India"
kapitaltech,19.0104072,72.8362093,"20th - Floor, A Wing, TOWER-1, Elphinstone (W), Babasaheb Ambedkar Nagar, Mumbai, Maharashtra 400013, India"
alchemy capital management pvt ltd,18.9255369,72.8302175,"B-4, Amerchand Mansion, 16, Madame Cama Rd, Dr Ambedkar Statue Chowk Area, Colaba, Mumbai, Maharashtra 400001, India"
mahesh tutorials,19.0759837,72.8776559,"Mumbai, Maharashtra, India"
upstox,19.0759837,72.8776559,"Mumbai, Maharashtra, India"
rksv,19.0759837,72.8776559,"Mumbai, Maharashtra, India"
sun capital advisory services (p) ltd,19.077886,72.866231,"301-A, third floor, Kumar Plaza, Near Market Kalina Santacruz, Kalina Kurla Road, Kolivery Village, Kunchi Kurve Nagar, Kalina, Santacruz East, Mumbai, Maharashtra 400029, India"
aeon credit service india private limited,19.1125839,72.8644048,"Unit No. 702 ,7th Floor, C & B Square Building, Andheri Kurla Road, Chakala, Andheri East, Dr. Charatsingh Colony, S B Singh Colony, J B Nagar, Andheri East, Mumbai, Maharashtra 400059, India"
trustplutus wealth managers (india) pvt ltd,19.0605151,72.8629879,"802, Naman Centre, G Block BKC, Bandra Kurla Complex, Bandra East, Mumbai, Maharashtra 400051, India"
inter-connected stock exchange of india ltd,19.060533,72.8493479,"Ifbc C-1, ""g""block, Bandra East, Government Colony, Bandra East, Mumbai, Maharashtra 400051, India"
square capital,19.0759837,72.8776559,"Mumbai, Maharashtra, India"
principal pnb asset management company pvt ltd,19.0759837,72.8776559,"Mumbai, Maharashtra, India"
axis finance limited,19.0076253,72.829386,"Axis House, Ground Floor, C2, Wadia International Centre, Pandurang Budhkar Marg, Kamagar Nagar Number 1, Worli, Mumbai, Maharashtra 400025, India"
multiples alternate asset management pvt. ltd.,18.9914933,72.8136506,"7th Floor, B-Wing Poonam Chambers,, Dr Annie Besant Rd, Worli, Dr Annie Besant Rd, Markandeshwar Nagar, Shiv Sagar Estate, Worli, Mumbai, Maharashtra 400018, India"
newswire18,18.928022,72.830933,"148, Mahatma Gandhi Road, Kala Ghoda, Fort, Mumbai, Maharashtra 400032, India"
smecorner,19.0759837,72.8776559,"Mumbai, Maharashtra, India"
capri global housing finance limited,19.0759837,72.8776559,"Mumbai, Maharashtra, India"
multi-act india,19.024365,72.843757,"10th Floor, The Ruby, The Ruby, 29, Senapati Bapat Marg, Dadar West, Dadar, Mumbai, Maharashtra 400028, India"
my financial advisor,19.0759837,72.8776559,"Mumbai, Maharashtra, India"
edelweiss financial services ltd - india,19.0701893,72.8634098,"Edelweiss House, Windsor Ln, Kolivery Village, MMRDA Area, Kalina, Santacruz East, Mumbai, Maharashtra 400098, India"
credila - an hdfc ltd company,19.0759837,72.8776559,"Mumbai, Maharashtra, India"
ghalla bhansali,19.0124417,72.84234640000001,"Devansh, 133, Dada Saheb Phalke Marg, Opposite Ranjeet Studio, Dadar East, Dadar, Mumbai, Maharashtra 400014, India"
baker tilly dhc,19.0759837,72.8776559,"Mumbai, Maharashtra, India"
aditya birla direct,19.0759837,72.8776559,"Mumbai, Maharashtra, India"
keynote corporate services limited,18.935592,72.8389844,"4th Floor, Balmar Lorry Building, 5, J N Hardiya Marg, Ballard Estate, Ballard Estate, Fort, Mumbai, Maharashtra 400001, India"
numbertree advisors pvt ltd,19.1285643,72.84609549999999,"No.25, 1st Floor, Dr R G Rao Villa, Caesar Road, Amboli, Andheri West, Kevni Pada, Jogeshwari West, Mumbai, Maharashtra 400058, India"
ftcash,19.1228384,72.8919657,"1005, Saki Vihar Rd, Saki Vihar, Budhia Jadhav Wadi, Marol, Andheri East, Mumbai, Maharashtra 400072, India"
baroda pioneer mutual fund,19.0759837,72.8776559,"Mumbai, Maharashtra, India"
tresvista financial services,19.1220323,72.87089879999999,"Plot 38, MIDC Central Rd, M.I.D.C, Marol MIDC Industry Estate, Andheri East, Mumbai, Maharashtra 400093, India"
staragri finance ltd.,19.082239,73.0109646,"office no. 112, 1 St Floor.Jayant Oil Mill Warehousing Compound, Phase 2, Sector 19A, Vashi, Navi Mumbai, Maharashtra 400705, India"
equitymaster agora research private limited,18.9244842,72.8214049,"103, Regent Chambers, above Status Restaurant, Nariman Point, Mumbai, Maharashtra 400021, India"
samco securities limited,19.0104193,72.83625390000002,"1004 - A, 10th Floor, Naman Midtown - A Wing Senapati Bapat Marg, Fitwala Rd, Babasaheb Ambedkar Nagar, Mumbai, Maharashtra 400013, India"
forex4you,19.106685,72.8613287,"3A, SILVER JADE CHS LTD. TARUN BHARAT,, CHAKALA, ANDHERI (E), near ORIENTAL ASTER HOTEL, Wing-C, Dawoolwadi, Andheri East, Mumbai, Maharashtra 400099, India"
montage capital markets ltd,19.0617142,72.8643278,"27, Bandra Kurla Complex Rd, G Block BKC, MMRDA Area, Kalina, Bandra East, Mumbai, Maharashtra 400098, India"
apnapaisa pvt. ltd.,19.0759837,72.8776559,"Mumbai, Maharashtra, India"
satco capital markets ltd,19.0597217,72.8321132,"101, 1st Floor, A Wing, Devrup Co-op Society Ltd, 36, Turner Rd, opp. Tava Restaurant, Bandra West, Mumbai, Maharashtra 400050, India"
khush housing finance pvt. ltd.,19.2190726,72.8517979,"810, Aura Biplex, Swami Vivekananda Rd, Shastri Nagar, Mulji Nagar, Borivali West, Mumbai, Maharashtra 400092, India"
