Name,latitude,longitude,Address
fitnessforce club management software,19.1065508,72.8827021,"501A, Town Centre, 2 127, Andheri - Kurla Rd, Mittal Industrial Estate, Marol, Andheri East, Mumbai, Maharashtra 400059, India"
e2serv technologies,19.0089608,73.0319773,"204, Chawla Complex, Sector 15, CBD Belapur, Navi Mumbai, Maharashtra 400614, India"
vizualize technologies,19.0759837,72.8776559,"Mumbai, Maharashtra, India"
cloudpoint technologies pvt. ltd.,19.121698,72.87268639999999,"91 SPINGBOARD, 74 TECHNO PARK 74/II, C-CROSS ROAD, OPP SEEPZ GATE NO.2, Marol MIDC Industry Estate, Andheri East, Mumbai, Maharashtra 400093, India"
smartcirqls,18.9972755,72.8248976,"1206, 12th floor, Marathon Nextgen Icon, Off G.K. Marg, Lower Parel West, Lower Parel, Mumbai, Maharashtra 400013, India"
solsynch technologies private limited,19.191972,72.8455243,"5A Dheeraj, Poddar Rd, near ASPEE NUTAN ACADEMY, Malad, Mahavir Nagar, Malad East, Mumbai, Maharashtra 400097, India"
bitsy infotech pvt. ltd.,19.1821064,72.8470573,"No. 56, Swami Vivekananda Rd, Malad, Reserve Bank of India Staff Quarters, Raheja Twp, Borivali West, Mumbai, Maharashtra 400092, India"
optron technologies,19.1740959,72.8414927,"5070, Rustomjee Eaze Zone, Malad, Sunder Nagar, Malad West, Mumbai, Maharashtra 400064, India"
fourth signal,19.1137308,72.8611943,"502, C Wing, Solitaire Corporate Park, Business Square, Andheri - Kurla Rd, Andheri East, Mumbai, Maharashtra 400093, India"
quickwork,19.108969,72.85169599999999,"404, Matharu Arcade, Subhash Rd, Victory Society, Navpada, Vile Parle East, Vile Parle, E, Maharashtra 400057, India"
ssis group,19.1740061,72.8462399,"Office No 10, Workafella AK Estate, Off Veer Savarkar Flyover, Swami Vivekananda Rd, Malad, Liliya Nagar, Goregaon West, Mumbai, Maharashtra 400062, India"
pristine infosolutions,19.106417,72.88286,"305-B, Town Centre II, Andheri - Kurla Rd, Mittal Industrial Estate, Marol, Andheri East, Mumbai, Maharashtra 400059, India"
mastiff tech pvt. ltd.,19.0759837,72.8776559,"Mumbai, Maharashtra, India"
creative web mall india pvt ltd,19.1125205,72.9181907,"E/510, Jogeshwari - Vikhroli Link Rd, Hiranandani Gardens, HMPL Surya Nagar, Vikhroli West, Mumbai, Maharashtra 400079, India"
acxiom technologies,19.0759837,72.8776559,"Mumbai, Maharashtra, India"
oneroof technologies llp,19.176279,72.9596668,"704, Business Ecstasy, JSD, near City Of Joy, Ashok Nagar, Mulund West, Mumbai, Maharashtra 400080, India"
emaginationz technologies,19.0737868,72.9997087,"615, Plot 76, JK Chambers Building, Sector 17, Vashi, Navi Mumbai, Maharashtra 400703, India"
gray routes,19.100248,72.88279899999999,"Unit No. 001, Elecon Chambers Sakinaka Saki Naka,, Telephone Exchange Rd, Andheri East, Mumbai, Maharashtra 400072, India"
choiceconnex (a div of ssapl),19.1137096,72.8713841,"Kantilal Compound, RK Mandir Rd, Bhim Nagar, Andheri East, Mumbai, Maharashtra 400069, India"
leo9 studio,19.240592,72.842732,"202, Techno it park, Link road, Road, Eksar Village, Eksar, Borivali, w, Maharashtra 400091, India"
agami tech,19.1045933,72.8803888,"A 303-304, Mittal Commercia, Hasan Pada Rd, Chimatpada, Marol, Andheri East, Mumbai, Maharashtra 400059, India"
atulsia technologies,19.1766013,72.96034110000001,"Office #811, Ecstasy Business Park, JSD, near Citi Of Joy, Ashok Nagar, Mulund West, Mumbai, Maharashtra 400080, India"
swqa india,19.1074986,72.851846,"E Square, 417, Subhash Rd, Vishnu Prasad Society, Navpada, Vile Parle East, Vile Parle, Mumbai, Maharashtra 400057, India"
pinwheel technology pvt. ltd.,19.2304084,72.86353129999999,"6VJ7+5C7, Kulupwadi, Borivali East, Mumbai, Maharashtra 400066, India"
hatio innovations private limited,19.1336539,72.83656599999999,"801, Supreme Chambers, 17/18, Shah Ind Estate, Industrial Area, Andheri West, Mumbai, Maharashtra 400053, India"
sankey solutions,19.1975105,72.9477311,"423/A-Wing Lodha Supremus II, Rd Number 22, Wagle Industrial Estate, Thane West, Thane, Maharashtra 400604, India"
t technologies,19.1898861,72.8354552,"911, Ghanshyam Enclave Besides Lalji Pada, Police Station, New Link Rd, Malad, Kanchpada, Kandivali West, Mumbai, Maharashtra 400067, India"
conventus technologies private limited,19.0810739,72.88668539999999,"3, Kirol Rd, Premier Residencies, Vidyavihar, Mumbai, Maharashtra 400070, India"
speakinglamp technologies pvt. ltd.,19.0759837,72.8776559,"Mumbai, Maharashtra, India"
affix center softech services pvt. ltd.,19.1053439,72.8872238,"B Wing, 407 / Ill, Pranik Chambers, Saki Vihar Road, Sakinaka, Junction, Sag Baug, Marol, Andheri East, Mumbai, Maharashtra 400072, India"
ajm softwares,19.0759837,72.8776559,"Mumbai, Maharashtra, India"
indian financial technology & allied services (iftas),20.593684,78.96288,India
digital alchemy india pvt. ltd.,19.038999,72.8420494,"2, Trade Centre, Olympus Building, New Dinkar Co Operative Housing Society, Mahim, Mumbai, Maharashtra 400016, India"
algorisys technologies private limited,19.093362,72.9142979,"Gold Crest Business Park, 2nd Floor, 208-209, Opp. Shreyas Cinema, Lal Bahadur Shastri Rd, Nityanand Nagar, Ghatkopar(W, Mumbai, Maharashtra 400086, India"
16 works,19.0759837,72.8776559,"Mumbai, Maharashtra, India"
vphrase analytics solutions pvt. ltd.,19.112192,72.88818400000001,"301, Petrol Pump, T Square, Saki Vihar Rd, opposite Chandivali, Ganesh Nagar, Marol, Andheri East, Mumbai, Maharashtra 400072, India"
digitaslbi india,18.997429,72.8287125,"17th Floor,Tower A, Urmi Estate, Ganapatrao Kadam Marg, Nagin Nagar Chawl, Lower Parel West, Lower Parel, Mumbai, Maharashtra 400013, India"
iotap india,19.0010956,72.8283584,"Empire Industries Ltd. The Empire Business Centre, 414, Senapati Bapat Marg, Lower Parel, Mumbai, Maharashtra 400013, India"
maraekat infotech ltd.,19.099149,72.886042,"B-504, Trade Square, Behind Mehra Mill compound,, Saki Naka, Kurla - Andheri Road,, Safed Pul, Saki Naka, Mumbai, Maharashtra 400072, India"
techsevin,19.1839991,72.83173479999999,"Unit no 101 / 102, IJMIMA, Opp Interface, behind Infinity Mall, Malad, Mindspace, Malad West, Mumbai, Maharashtra 400064, India"
appmix technologies,19.137102,72.8341465,"B 303, Fairlink Centre, Off New Link Rd, Veera Desai Industrial Estate, Andheri West, Mumbai, Maharashtra 400053, India"
terbium solutions,18.9966512,72.8245452,"901, B2 Wing, Marathon Innova Corporate Centre Ganpat Rao Kadam Marg Near Peninsula Corporate Park, Lower Parel West, Lower Parel, Mumbai, Maharashtra 400013, India"
webconcepts4u.com pvt ltd,19.0759837,72.8776559,"Mumbai, Maharashtra, India"
inkswipe consulting llp,19.0759837,72.8776559,"Mumbai, Maharashtra, India"
adweb,19.1735165,72.8481051,"309/3, Shree Krishna Commercial Centre, 6, Vinod Sanghi, Udyog Nagar, Goregaon West, Mumbai, Maharashtra 400062, India"
unicus interactive,19.222412,72.8297798,"Hemavati Co-operative Housing Society, No 7, A-403, RSC Road, Charkop, Sector 7, RDP 8, Sector 7, Kandivali West, Mumbai, Maharashtra 400067, India"
new era informatique pvt ltd,19.129174,72.93072389999999,"709, Lodha Supremus, Nehru Nagar, Kanjurmarg East, Mumbai, Maharashtra 400042, India"
massblurb,19.0759837,72.8776559,"Mumbai, Maharashtra, India"
"computer society of india, mumbai chapter",19.1238457,72.8707423,"Samruddhi Venture Park, Krantiveer Lakhuji Salve Marg, Marol, Subash Nagar, Chakala Industrial Area (MIDC), Andheri East, Mumbai, Maharashtra 400069, India"
auisy technologies.,19.0759837,72.8776559,"Mumbai, Maharashtra, India"
softgainz technologies pvt. ltd.,19.0759837,72.8776559,"Mumbai, Maharashtra, India"
datagrid solutions pvt. ltd.,19.111338,72.860035,"604/605, Crystal Plaza, Guru Hargovindji Rd, next to Atul Projects, Chakala, Andheri East, Mumbai, Maharashtra 400099, India"
tim infratech pvt. ltd.,19.0868722,72.83794089999999,"02/B-3, Akash CHS, Khira Nagar, Swami Vivekananda Rd, Khira Nagar, Santacruz West, Mumbai, Maharashtra 400054, India"
symphony technoventures pvt. ltd.,19.0559675,72.8331918,"A/22, 2nd floor, Elco Arcade, 84, Hill Rd, Bandra West, Mumbai, Maharashtra 400050, India"
effission software pvt ltd,18.9537342,72.8183134,"615, Parekh Market Building, Charni Road East, Opera House, Girgaon, Mumbai, Maharashtra 400004, India"
assembling point,19.0759837,72.8776559,"Mumbai, Maharashtra, India"
escs,19.123686,72.8911751,"B-40, Solaris I Complex, Saki Vihar Rd, Maharashtra Nagar, Vidya Milind Nagar, Marol, Andheri East, Mumbai, Maharashtra 400072, India"
ornate software solutions pvt ltd,19.01897,73.039236,"C204, Tower No 8, above CBD Belapur Railway station, Sector 11, CBD Belapur, Navi Mumbai, Maharashtra 400614, India"
trip in inc,19.0759837,72.8776559,"Mumbai, Maharashtra, India"
shriya innovative solutions,19.1788451,72.84355459999999,"Advent Atria 301 Chincholi Bunder Road Malad W, Mandlik Nagar, Sunder Nagar, Malad West, Mumbai, Maharashtra 400064, India"
infoton systems & services pvt ltd,19.0901765,72.8687391,"503 E wing, Raheja Heights, General Arunkumar Vaidya Marg, Dindoshi, Malad (East), Navpada, Vile Parle East, Vile Parle, Mumbai, Maharashtra 400047, India"
mobcast innovations,19.2017495,72.86123599999999,"MobCast Innovations Pvt. Ltd 505 Tanishka, 5th Floor Nr Growels 101 Mall, Akurli Rd, Kandivali, Akurli Industry Estate, Kandivali East, Mumbai, Maharashtra 400101, India"
cloudxchange.io,19.0662579,72.99908239999999,"Real Tech Park, 714, Bhagwan Mahaveer Rd, Sector 30A, Vashi, Navi Mumbai, Maharashtra 400703, India"
parekh marine agencies private limited,19.0759837,72.8776559,"Mumbai, Maharashtra, India"
technople solutions,19.203169,72.851168,"Office no. 4, 2nd floor, Avirahi Arcade,, Vasanji Lalji Road, Jethava Nagar, Kandivali West, Kandivali, Jethava Nagar, Kandivali West, Mumbai, Maharashtra 400067, India"
techshastra,19.0759837,72.8776559,"Mumbai, Maharashtra, India"
elemental crafts,19.0759837,72.8776559,"Mumbai, Maharashtra, India"
popular infotech pvt ltd,19.1232297,72.8909453,"E 264, Solaris 1, Opp L&T Gate no 6, Maharashtra Nagar, Vidya Milind Nagar, Marol, Powai, Mumbai, Maharashtra 400072, India"
aeon communication pvt. ltd.,19.063005,72.998414,"Tower No. 2, B-203, Infotech Park, Sector 30A, Vashi, Navi Mumbai, Maharashtra 400703, India"
humanware technology pvt ltd,19.017008,73.037339,"Mayuresh Chamber 1106 , plot 60, Sector 11, CBD Belapur, Navi Mumbai, Maharashtra 400614, India"
uknowva,19.0893148,72.9078057,"A-205, Skyline Epitome, behind Jolly Gymkhana, Gangawadi, Vidyavihar, Mumbai, Maharashtra 400086, India"
kalyx infotech pvt ltd,19.0116259,72.82436059999999,"419, 423 Kaliandas Udyog Bhavan, Near Century Bazar, Century Bazaar, Prabhadevi, Mumbai, Maharashtra 400025, India"
3i infotech limited,19.1007542,72.8831168,"Crescent Solitaire, 3rd Floor, Solitaire Business Park, Sakinaka, opposite Telephone exchange, Andheri East, Mumbai, Maharashtra 400072, India"
eiosys inc.,19.0579137,72.8650088,"WeWork Enam Sambhav, C, 20, G Block Rd, G Block BKC, Bandra Kurla Complex, Bandra East, Mumbai, Maharashtra 400051, India"
thakrar infotrendz pvt. ltd.,19.0931678,72.9139343,"412, Swastik Disa corporate park,, Ghatkopar west, opp. Shreyas cinema, Nityanand Nagar, Ghatkopar West, Mumbai, Maharashtra 400086, India"
guiddoo world travels pvt ltd,19.1837834,72.83173889999999,"721-722 Ijmima Complex, New Link Rd, behind Goregaon Sports Club, Malad, Mindspace, Malad West, Mumbai, Maharashtra 400064, India"
worldwide records limited,19.1330694,72.8141407,"135, JP Rd, Aram Nagar Part 2, Machlimar, Seven Bunglow, Andheri West, Mumbai, Maharashtra 400061, India"
xtremsoft technologies pvt ltd,19.1096223,72.8818069,"802 Jai Antariksha, Makwana Rd, Andheri East, Gamdevi, Marol, Andheri East, Mumbai, Maharashtra 400059, India"
nwdco,19.0831117,72.8404308,"19, 3rd Floor, Hi Life, Phirozshah Mehta Rd, Railway Colony, Santacruz West, Mumbai, Maharashtra 400054, India"
dotcom services (india) pvt. ltd.,19.161934,72.857184,"101, 102 & 103, Tirupati Udyog Premises, I. B. Patel Road, near HP Petrol Pump, Jay Prakash Nagar, Goregaon, Mumbai, Maharashtra 400063, India"
libra web solutions,19.1701179,72.8779015,"Kshitij CHS, Satellite Tower, D-004, Film City Rd, Laxmi Nagar, Municipal Colony, Goregaon, Mumbai, Maharashtra 400063, India"
bluemango solutions pvt ltd,19.1081028,73.0178505,"Unit 301, Building 6, Sector 3, Millenium Business Park, MIDC Industrial Area, Sector 1, Mahape, Navi Mumbai, Maharashtra 400703, India"
tranzact,19.1089719,72.8854698,"6th Floor, WeWork Raheja Platinum, off Andheri - Kurla Road, Sag Baug, Marol, Andheri East, Mumbai, Maharashtra 400059, India"
pacific consulting,19.1618147,72.8507171,"132, Udyog Bhavan, Sonawala Rd, Jay Prakash Nagar, Goregaon, Mumbai, Maharashtra 400063, India"
map my marketing pvt ltd,19.1089847,72.8825523,"244, Shiv Shakthi Industrial Estate, Andheri Kurla Road, Marol, Andheri East, Gamdevi, Marol, Andheri East, Mumbai, Maharashtra 400059, India"
b2 information systems pvt. ltd,19.0759837,72.8776559,"Mumbai, Maharashtra, India"
greeksoft technologies pvt. ltd.,19.218818,72.86524299999999,"5th Floor, 507, Western Edge I, Western Express Hwy, Food Corporation of India Warehouse, Borivali East, Mumbai, Maharashtra 400066, India"
in-solutions global pvt. ltd.,19.1558474,72.8552583,"14-B, Romell Tech Park, NIRLON KNOWLEDGE PARK, Western Express Hwy, Cama Industrial Estate, Goregaon, Mumbai, Maharashtra 400063, India"
iconic techno solutions pvt. ltd.,19.114576,73.0166799,"105, 1st Floor, Technocity, Plot No. X 5/3, MIDC, Mahape, Opp MBP, Next to Sarovar Portico,, Reliance Corporate Park, MIDC Industrial Area, Ghansoli, Navi Mumbai, Maharashtra 400701, India"
cylsys software solution pvt ltd.,19.1575067,72.8346857,"85/86, FIRST FLOOR, Harmony Mall, New Link Rd, Sejal Park, Colony No 1, Bhagat Singh II, Goregaon West, Mumbai, Maharashtra 400104, India"
shifastar technologies pvt.ltd.,19.12408,72.870553,"C-609, Floral Deck Plaza, M.I.D.C, Seepz, Andheri East, Mumbai, Maharashtra 400093, India"
fusion softwares & systems pvt. ltd.,19.1092424,72.8443166,"Shop No. 2, Snehadhara C. H. S, Irla, Dadabhai Cross Road No. 3, Vile Parle West, Mumbai - 400056, Snehadhara Society, Navpada, Irla, Vile Parle West, Mumbai, Maharashtra 400047, India"
dux soft pvt. ltd.,19.0759837,72.8776559,"Mumbai, Maharashtra, India"
notiontechnologies,19.107839,73.0189327,"109 bldg, No. 2, Millenium Business Park, Sector 3, Mahape, Navi Mumbai, Maharashtra 400710, India"
first quadrant group,19.0759837,72.8776559,"Mumbai, Maharashtra, India"
swarajya infotech,19.016955,72.8204671,"Raj Mestry, Room No 36, Janata Colony, Behind 169 Bus Stop, Worli Village, Janata Colony, BPT Colony, Worli, Mumbai, Maharashtra 400030, India"
sdi techservices india pvt. ltd;,19.1046617,72.8504727,"1 Smruti, M V, Mahadev Rao Vishnu Panloskar Marg, Om Shri Siddhivinayak Society, Navpada, Vile Parle East, Vile Parle, Mumbai, Maharashtra 400057, India"
vervali systems pvt ltd,19.0759837,72.8776559,"Mumbai, Maharashtra, India"
cms it training institute,19.019222,72.841438,"207, 2nd floor, Yash Plaza, Dr D Silva Rd, Near Shagun Restaurant, Near Kabutar khana, Dadar West, Dadar, Mumbai, Maharashtra 400028, India"
akshay software technologies ltd,19.1089394,73.0175954,"Building 2, 214, MBP Rd, Sector I, MIDC Industrial Area, Sector 1, Kopar Khairane, Navi Mumbai, Maharashtra 400710, India"
krish mark infotech india pvt ltd,19.1143843,73.0143367,"804 B-Wing Technocity IT Park Above IDBI Bank, Reliance Corporate Park, MIDC Industrial Area, Mahape, Navi Mumbai, Maharashtra 400710, India"
navsya technologies private limited,19.1734857,72.9616327,"C-101, Sai Classic, Palm Acres, 90ft Road, Mulund (East), Hanuman Chowk, Mulund East, Mumbai, Maharashtra 400081, India"
itv computers pvt ltd,19.2054879,72.8468276,"11,Sakhi Apartments, M.G.Road, Kandivali(W), Mumbai 400067, Maharashtra, India, Mahatma Gandhi Rd, Kandivali West, Mumbai, Maharashtra 400067, India, Mahatma Gandhi Rd, Kandivali, Parekh Nagar, Kandivali West, Mumbai, Maharashtra 400067, India"
forbinary,19.0474837,72.9116477,"Office number 109/110, Ujagar Chambers, Off, Sion - Trombay Rd, next to Deonar Bus Depot, MBPT Colony, Deonar, Chembur, Mumbai, Maharashtra 400088, India"
plada technologies pvt ltd,19.1254372,72.8502342,"Plada Technologies Pvt Ltd, Plada House, Santosh Anil Mishra Compound Opposite Colopen Limited,Jadunath Mishra Chowk, Mogra, Village Rd, Mogra Pada, Natwar Nagar, Andheri East, Mumbai, Maharashtra 400069, India"
levia technologies private limited,19.0108402,73.0329334,"15, Palm Beach Rd, Sector 15, CBD Belapur, Navi Mumbai, Maharashtra 400614, India"
openspace services,19.2407328,72.84253269999999,"611, Techno It Park, New Link Rd, nr. Eskay Resort, Eksar Village, Eksar, Borivali West, Mumbai, Maharashtra 400092, India"
tacto infomedia private limited,19.0759837,72.8776559,"Mumbai, Maharashtra, India"
upayas infotech pvt ltd,19.1957762,72.9489399,"Plot No.128,, Wagle Estate Rd, Wagle Industrial Estate, Thane West, Thane, Maharashtra 400604, India"
4p advisory services,19.0654398,72.995967,"4P Advisory Services, 219, Platinum Technopark, 2nd Floor, above Mainland China, Plot 17& 18, Bhagwan Mahaveer Rd, Sector 30A, Vashi, Navi Mumbai, Maharashtra 400703, India"
big rattle technologies,19.1044592,72.8807628,"Mittal Commercia, A-404, Hasan Pada Rd, Mittal Industrial Estate, Marol, Andheri East, Mumbai, Maharashtra 400059, India"
bookmein,19.1065461,72.8831845,"115, Mittal Industrial Estate, Marol, 2, Mumbai, Maharashtra 400059, India"
primeleaf consulting (p) ltd,19.0218915,72.8371813,"29, Hendre Castle, D.S.Babrekar Marg,, Gokhale Road (North), Dadar (West), Chandrakant Dhuru Wadi, Dadar, Mumbai, Maharashtra 400028, India"
fortune grecells p ltd,18.956727,72.811538,"Office 2, Kotak Kunj, 36, Old Chowpatty Rd, near Bhartiya Vidya Bhavan, Gamdevi, Mumbai, Maharashtra 400007, India"
ajackus,19.121698,72.87268639999999,"74 Techno Park, Gate No 2, Cross Rd C, M.I.D.C, Seepz, Andheri East, Mumbai, Maharashtra 400093, India"
zonnett,19.2454849,72.8491967,"6RWX+5MW, IC Colony Rd, I C Colony, Maryland Complex, Borivali West, Mumbai, Maharashtra 400103, India"
render india infotech pvt ltd,19.0759837,72.8776559,"Mumbai, Maharashtra, India"
destar technologies pvt. ltd.,18.9838949,72.8475414,"505 - 506, Bharat Industrial Estate,T.J.Road, Sewri, Sewri, Mumbai, Maharashtra 400015, India"
sensehawk,19.0759837,72.8776559,"Mumbai, Maharashtra, India"
penguinapps,19.214389,72.8697394,"Raheja Metroplex, 602, Off Link Road, Kandivali, Dattani Park, Thakur Village, Malad West, Mumbai, Maharashtra 400064, India"
aditi tracking support pvt ltd.,19.1859977,72.84682269999999,"5RPW+9PW, Swami Vivekananda Rd, Malad, Vijaykar Wadi Industrial, Vijaykar Wadi, Malad West, Mumbai, Maharashtra 400064, India"
atcom mobitech pvt. ltd.,19.1118744,72.8922252,"E-3, Tex Centre, 3rd Floor,, Chandivali Farm Rd, Yadav Nagar, Chandivali, Powai, Mumbai, Maharashtra 400072, India"
testriq qa lab,19.276481,72.8572513,"304, Sai Arpan Building, Railway Sta Rd, near PG Vora School, Shanti Vihar, Mira Road East, Mira Bhayandar, Maharashtra 401107, India"
premierinfo,19.1736156,72.9560817,"A-9/10/27, Patil Bhavan, NS Rd, near Railway Station, Mulund West, Mumbai, Maharashtra 400080, India"
super infomatics pvt ltd,19.0875813,72.9092408,"A 502, Jay Vijay, 5th Road, Opposite Hindi High School,, Laxminarayan Lane, Near Ghatkopar Metro Station, Ghatkopar (WEST), CGS Colony, Ghatkopar West, Mumbai, Maharashtra 400086, India"
comtelservice pvt ltd,19.0759837,72.8776559,"Mumbai, Maharashtra, India"
intivion technologies,19.1162488,72.85640579999999,"The Summit Business Bay (Omkar), Andheri - Kurla Rd, adjacent to Cinemax, Chakala, Andheri East, Mumbai, Maharashtra 400093, India"
tantragyan technologies pvt ltd,19.0759837,72.8776559,"Mumbai, Maharashtra, India"
affaan technologies,19.2746176,72.8695942,"D-222, Shanti Shopping Center, Mira Road East, Sector 5, Mira Road East, Thane, Maharashtra 401107, India"
jknotch business solutions llp,19.1071583,73.0224625,"Millennium Business Park, Unit 301, Building # 4, Sector # 3, TTC, MIDC,, Mahape, MIDC Industrial Area, Sector 3, Kopar Khairane, Navi Mumbai, Maharashtra 400710, India"
appectual it solutions,19.1676362,72.8529958,"706, B, Off, Aarey Rd, near Udipi Vihar Hotel, Vishveshwar Nagar, Goregaon, Mumbai, Maharashtra 400063, India"
capital market publishers india pvt. ltd,19.0547357,72.88819289999999,"401, Swastik Chambers, Sion - Trombay Rd, Swastik Park, Chembur, Mumbai, Maharashtra 400071, India"
ivida technologies pvt. ltd.,19.1158712,72.8684315,"A-10B, Rd Number 4, Bhim Nagar, Andheri East, Mumbai, Maharashtra 400053, India"
deevoir shared services,19.17827,72.834051,"505, B Wing, KEMP Plaza, Off, Chincholi Bunder Rd, Extension, Mindspace, Malad West, Mumbai, Maharashtra 400064, India"
senseware infomedia pvt. ltd.,19.2130192,72.8676618,"318, V Mall, Thakur Complex Rd, Kandivali, Asha Nagar, Kandivali East, Mumbai, Maharashtra 400101, India"
master computech pvt. ltd.,19.016028,72.838366,"1, Hedavkar Estate, Bhavani Shankar Road,, Dadar(West), next to Jay Gopal Ind. Estate, Near Kabutar khana, Babasaheb Ambedkar Nagar, Dadar, Mumbai, Maharashtra 400028, India"
yes crm consultants,19.1239985,72.8502094,"117/118, New Apollo Estate, 23 Mogra Road, Mogra Village, Mogra Pada, Natwar Nagar, Andheri East, Mumbai, Maharashtra 400069, India"
priserve infratech ltd,19.0759837,72.8776559,"Mumbai, Maharashtra, India"
jaincotech india,19.0759837,72.8776559,"Mumbai, Maharashtra, India"
ahy consulting,19.1906795,72.9792346,"Ahy Consulting, 79, 1st Floor, Jai Hind Complex,, Kharton Road, opposite Bedekar College, Juhu Chandan Society, Jambli Naka, Thane West, Thane, Maharashtra 400601, India"
fifth quarter infomedia pvt ltd,19.202296,72.8487998,"B/8, Ground floor, Sahyog Apartment, Swami Vivekananda Rd, opposite Lohana Mahajan Wadi, Kandivali, Bhagat Colony, Kandivali West, Mumbai, Maharashtra 400067, India"
venuslabs web solutions,19.0759837,72.8776559,"Mumbai, Maharashtra, India"
abak infotech pvt ltd,19.0715781,72.9985366,"A/6, Ashiana, Sector 17, Vashi, Navi Mumbai, Mumbai suburban, India, Sector 17, Vashi, Mumbai, Maharashtra 400703, India"
simsol technologies & services pvt ltd,19.1599276,72.9368078,"509, Filix Tower, Lal Bahadur Shastri Rd, Sonapur, Bhandup West, Mumbai, Maharashtra 400078, India"
abby people finders,19.0759837,72.8776559,"Mumbai, Maharashtra, India"
setu net pvt. ltd.,19.1230304,72.91260439999999,"608, Gateway Plaza, Central Ave, Hiranandani Gardens, Panchkutir Ganesh Nagar, Powai, Mumbai, Maharashtra 400076, India"
"inteliwaves technology private limited (sap s/4 hana, simple finance (sfin), sap fiori consulting)",19.0759837,72.8776559,"Mumbai, Maharashtra, India"
officingnow,19.1292452,72.836039,"E-MERGE WORKSPACES & TECHNOLOGIES PVT LTD. B 205, B-Wing, Bldg-42 Azad Nagar Sangam CHS, Azad Nagar, Andheri West, Mumbai, Maharashtra 400053, India"
metasys software pvt. ltd.,19.174699,72.847067,"Unit No. 18, 2nd Floor, Techniplex I, Off., Veer Savarkar Flyover, Malad, Liliya Nagar, Goregaon West, Mumbai, Maharashtra 400062, India"
2soft solutions pvt ltd,19.1124787,72.8489543,"103, 1st Floor, Shivam Square, Shree Tirupati, Cluster_mumbai Suburban_684 Balaji Chs, 4, Sahar Rd, Koldongri, Andheri (E, Mumbai, Maharashtra 400069, India"
unified data-tech solutions pvt. ltd.,19.0759837,72.8776559,"Mumbai, Maharashtra, India"
tech morphosis,18.9941224,72.8277782,"A/2, 480-481, Shah & Nahar Ind Est, SJ Marg, Lower Parel, Lower Parel, Mumbai, Maharashtra 400013, India"
expandus networking systems pvt. ltd.,19.0759837,72.8776559,"Mumbai, Maharashtra, India"
acyuta technologies pvt ltd,19.1083471,72.8840878,"Unit 104, Tower D, Times Square Bldg, Gamdevi, Marol, Andheri East, Mumbai, Maharashtra 400059, India"
creative peripherals and distribution private limited,18.9599207,72.8174914,"375/377, Babu Bldg, Office. No. 20, 2Nd Floor, Lamington Road, Grant Road (E), Krishna Kunj, Grant Road East, Shapur Baug, Girgaon, Mumbai, Maharashtra 400007, India"
ebuild software solutions private limited,19.0759837,72.8776559,"Mumbai, Maharashtra, India"
card pro solutions pvt ltd,18.9927481,72.83108120000001,"135 Level 1 A to Z Industrial Estate GK Marg, Lower Parel, Lower Parel East, BDD Chawl, Lower Parel, Mumbai, Maharashtra 400013, India"
three 13 solutions pvt. ltd.,19.0998858,72.8811712,"404, Crescent Business Park, Bombai, Saki Naka, Andheri, Maharashtra 400072, India"
zaintechs consultants,19.2356782,72.9767705,"Plot # 636/423, 1st Floor, Rai Master Compound, Jai Bhavani Industrial, Estate, Chitalsar, Manpada, Manpada, Thane West, Thane, Maharashtra 400607, India"
smartify health,19.0759837,72.8776559,"Mumbai, Maharashtra, India"
dragon computerz,19.041074,72.85602899999999,"E- V.O.C. Tower, 508, 90 Feet Rd, P.K. Kunte Nagar, Kamala Nehru Nagar, RP Nagar, Dharavi, Mumbai, Maharashtra 400012, India"
thinpc technology pvt ltd,19.1058124,72.8822397,"Bldg. No.4, Ground floor, Gala no. 1, 2, 3, 4, Andheri - Kurla Rd, Mittal Industrial Estate, Marol, Andheri East, Mumbai, Maharashtra 400059, India"
dave infotech,18.9958294,72.8322815,"107, Shanti Centre, 154, M C C H, Near Shivaji Chowk, Panvel, Panvel, BDD Chawl, Lower Parel, Panvel, Maharashtra 410206, India"
delta services india pvt. ltd.,19.0759837,72.8776559,"Mumbai, Maharashtra, India"
paloji technologies,19.1174604,73.00282229999999,"53 Plot No 92 - 96, Panchavati Plaza CHS, 95-96, Sector Number 5 Rd, Sector 5, Savoli, Ghansoli, Navi Mumbai, Maharashtra 400701, India"
techathalon software solutions,19.1823542,72.9543456,"403A,Flying colors Co-operative Society Ltd, Bus Depot, Purushottam Kheraj Rd, next to Check naka, Siddharth Nagar, Mulund West, Mumbai, Maharashtra 400080, India"
dreamscape media private limited,19.1404248,72.834859,"307, Crescent Towers, Jogeshwari, Off Link Road, Veera Desai Industrial Estate, Andheri West, Mumbai, Maharashtra 400053, India"
