Name,latitude,longitude,Address
blowfish digital in,19.0651497,72.8350928,"604, Makhija Arcade, 35th Rd, Khar, Khar West, Mumbai, Maharashtra 400052, India"
the brand brewery,19.190801,72.837059,"202, B2B Agarwal Centre, D'Monte Lane Next to Malad Industrial Estate,, Malad West, Malad, Kanchpada, Malad West, Mumbai, Maharashtra 400064, India"
supercraft events and activations,19.140252,72.83489560000001,"703 Crescent Royale, Off New Link Road, Near Crescent Towers, Veera Desai Industrial Estate Rd, Veera Desai Industrial Estate, Andheri West, Mumbai, Maharashtra 400053, India"
reverse thought creative studio pvt. ltd.,19.17829,72.84383930000001,"C 601, Kingston Heights, Chincholi Bunder Rd, Mandlik Nagar, Sunder Nagar, Malad West, Mumbai, Maharashtra 400064, India"
the zero games(plakc),19.1465755,72.8291903,"1009, Samarth Vaibhav, Off Link Road, Tarapore Gardens, Milat Nagar, Andheri West, Mumbai, Maharashtra 400054, India"
insomniacs,19.1186263,72.8703548,"203, 2nd Floor, Ackruti Star, MIDC Central Rd, Kondivita, Andheri East, Mumbai, Maharashtra 400093, India"
fiskaz digital marketing solutions private limited,19.0659362,72.830845,"4/Boon Apartment, 16th Road, Bandra West, near Mini Punjab Restaurant, Bandra West, Mumbai, Maharashtra 400050, India"
capslock digital solutions pvt ltd,19.1165713,72.8825342,"A, 107, Military Rd, Sankasth Pada Welfare Society, Marol, Andheri East, Mumbai, Maharashtra 400059, India"
digichefs,19.1097184,72.88177569999999,"Jai Antariksha, 3rd Floor, 306, Makwana Rd, Gamdevi, Marol, Andheri East, Mumbai, Maharashtra 400059, India"
genuus brand advisory,19.1173273,72.8921293,"Genuus Brand Advisory PVT Ltd , Unit No. 1112 & 1113, 1st Floor, C- Wing, Oberoi Garden Estate, Off, Saki Vihar Rd, Tunga Village, Chandivali, Andheri (E, Mumbai, Maharashtra 400072, India"
thinktag,19.0130151,72.8499491,"20B, Shriram Industrial Estate, E, G D Ambekar Rd, Shriram Industrial estate, Sahakar Nagar, Wadala, Mumbai, Maharashtra 400031, India"
image solution,19.1132671,72.8433273,"Flat No. 12, Alankar Apartment, First Floor, Plot No. 62, TPS VI,, Lallubhai Park, Andheri West, Bharucha Baug, Parsi Colony, Andheri West, Mumbai, Maharashtra 400058, India"
photolink creative india pvt. ltd.,19.0759837,72.8776559,"Mumbai, Maharashtra, India"
orion consulting ind,19.0759837,72.8776559,"Mumbai, Maharashtra, India"
pinxit blue,18.9908029,72.83959349999999,"2nd Floor, Super Procesor Industrial Estate, near Indian Express, Lal Baug, Parel, Mumbai, Maharashtra 400012, India"
seashell,18.9642004,72.8025947,"Sea Shells, Darabsha Ln, Breach Candy, Cumballa Hill, Mumbai, Maharashtra 400006, India"
grass roots india,19.0759837,72.8776559,"Mumbai, Maharashtra, India"
cupshup,19.1185706,72.89036569999999,"1001, CupShup, Lodha Supremus, Saki Vihar Rd, opposite MTNL office, Tunga Village, Chandivali, Powai, Mumbai, Maharashtra 400072, India"
surreal brand solutions india pvt ltd,19.096599,72.84194409999999,"Cello the VP Road,, Hemu Plaza, Sarojini Rd, LIC Colony, Suresh Colony, Vile Parle West, Mumbai, Maharashtra 400056, India"
the advertising standards council of india,19.0759837,72.8776559,"Mumbai, Maharashtra, India"
onspon,19.1075572,73.0194613,"101, Building 3 Sector III, Millenium Business Park, Sector 3, Mahape, Navi Mumbai, Maharashtra 400710, India"
therefore consultancy and services pvt ltd,19.0759837,72.8776559,"Mumbai, Maharashtra, India"
beeing social,19.0799508,72.8957997,"D 203, Neelkanth Business Park, Vidyavihar station skywalk, Sadguru Nagar, Neelkanth Kingdom, Vidyavihar West, Vidyavihar, Mumbai, Maharashtra 400086, India"
zenith ooh,19.0759837,72.8776559,"Mumbai, Maharashtra, India"
the womb communications,19.1105761,72.85453609999999,"11th floor, Classic Pentagon, Parshiwada, Chakala, Andheri East, Mumbai, Maharashtra 400053, India"
skytechsolution.in,19.0759837,72.8776559,"Mumbai, Maharashtra, India"
brand whiz,19.0594003,72.89735329999999,"301, Amrutvani, 44, Road No. 15, Chembur Gaothan, Chembur, Mumbai, Maharashtra 400071, India"
brand harvest consultancy pvt. ltd,19.1172873,72.889785,"604, 55 Corporate Avenue, Saki Vihar Rd, Tunga Village, Chandivali, Andheri East, Mumbai, Maharashtra 400072, India"
the whiteboard.company,19.0759837,72.8776559,"Mumbai, Maharashtra, India"
creative injection,19.1358314,72.8324653,"231, Karthik Complex, New, New Link Rd, near Fun Republic, Veera Desai Industrial Estate, Andheri West, Mumbai, Maharashtra 400053, India"
xeco,19.0729882,72.8696966,"Xeco Marketing Pvt. Ltd, BKC CST Link Rd, near L&T Financial Services, Kolivery Village, MMRDA Area, Bandra Kurla Complex, Santacruz East, Mumbai, Maharashtra 400098, India"
infectious advertising,19.1712297,72.845114,"401, 4th Floor, Pratiek Plaza, Swami Vivekananda Rd, opp. Patel Auto Pump, Mahesh Nagar, Goregaon West, Mumbai, Maharashtra 400062, India"
brandarms,19.1127544,72.8623879,"406, Tandon Apartments, Sharath Singh Colony, Andheri East, Dr. Charatsingh Colony, S B Singh Colony, J B Nagar, Andheri East, Mumbai, Maharashtra 400093, India"
ogma robur consulting llp,19.0759837,72.8776559,"Mumbai, Maharashtra, India"
perq advertising pvt ltd,19.1129083,72.8685788,"Sahar Plaza, B-111 Bonanza, Andheri - Kurla Rd, J B Nagar, Andheri East, Mumbai, Maharashtra 400059, India"
umbrella aegis,19.1313583,72.8557287,"1112, Hubtown Viva, Saraswati Baug, Shankarwadi, Jogeshwari East, Mumbai, Maharashtra 400060, India"
supari studios,18.9884246,72.81539560000002,"11th Floor, Discovery of India Building, Nehru Centre, Dr Annie Besant Rd, Lotus Colony, Worli, Mumbai, Maharashtra 400018, India"
guava creative solutions,19.1310414,72.81387029999999,"Behind Gurudwara (Autumn Caf, No. 38, Ground Floor, Plot, off JP Road, Aram Nagar Part 1, Aram Nagar, Versova, Andheri West, Mumbai, Maharashtra 400061, India"
dow media pvt ltd,19.1192296,72.8634739,"4 & 5, New Nandu Industrial Estate, Mahakali Caves Rd, Gundavali, Andheri East, Mumbai, Maharashtra 400093, India"
micro media marketing pvt. ltd.,19.0715042,73.0286079,"A603, Everest Nivara Infotech Park, D3, MIDC Main Rd, near Turbhe, Indira Nagar, MIDC Industrial Area, Turbhe, Navi Mumbai, Maharashtra 400705, India"
dealwithus.co.in,19.118577,72.90524599999999,"Shop no. 1051 , Inside Heera Panna Shopping Mall, 20, Orchard Avenue, MHADA Colony 19, Powai, MHADA Colony 19, Powai, Mumbai, Maharashtra 400076, India"
molecule communications,19.1308685,72.8234374,"Near Kokilabhen Dhirubhai Ambani Hospital, 1702, Ashirwad Tower, Four Bungalows, Andheri West, Mumbai, Maharashtra 400053, India"
vistaar digital communications pvt. ltd.,19.2280324,72.8578574,"Paras Business Centre, Unit 602, Carter Road No. 1, Near Kasturbha Police Station, Asara Colony, Borivali East, Mumbai, Maharashtra 400066, India"
media vantage,19.1346856,72.8131543,"Bungalow no, 52, Yari Rd, Aram Nagar Part 2, Jeet Nagar, Versova, Andheri West, Mumbai, Maharashtra 400061, India"
fourc healthvistas pvt. ltd,19.0759837,72.8776559,"Mumbai, Maharashtra, India"
print bindaas,19.0759837,72.8776559,"Mumbai, Maharashtra, India"
yellow seed content solutions,19.0728543,72.8696013,"First Floor, 91 Springboard, Kagalwala House CST Road, Kalina, behind Mercedes Showroom, Kolivery Village, MMRDA Area, Bandra Kurla Complex, Santacruz East, Mumbai, Maharashtra 400098, India"
circus elephants - a division of mmspl,19.0759837,72.8776559,"Mumbai, Maharashtra, India"
brandtouch & analytics,53.5449991,9.950361299999999,"Große Elbstraße 42, 22767 Hamburg, Germany"
prose consulting llp,19.0759837,72.8776559,"Mumbai, Maharashtra, India"
jazzap,19.061607,72.8376035,"WESTERN RAILWAY STAFF COLONY, बांदरा पश्चिम, मुंबई, महाराष्ट्र 400050, India"
socialkonnekt media pvt. limited,19.0759837,72.8776559,"Mumbai, Maharashtra, India"
ascent advertising pvt. ltd.,19.1895563,72.8388547,"321, Gemstar Commercial Complex Ramchandra Lane, Mamletdar Wadi Ext Rd, Malad, Kanchpada, Malad West, Mumbai, Maharashtra 400064, India"
brandniti + design,19.0993558,72.9163421,"Brandniti, 10th Floor, R City Mall, Lal Bahadur Shastri Rd, Amrut Nagar, Ghatkopar West, Mumbai, Maharashtra 400086, India"
blue star limited,19.0759837,72.8776559,"Mumbai, Maharashtra, India"
sterling and wilson,19.061525,72.91309249999999,"9, Universal majestic, PL Lokhande Marg, Chembur West, ACC Nagar, Chedda Nagar, Mumbai, Maharashtra 400043, India"
greaves cotton limited,19.0106854,72.83139349999999,"3rd Floor, Motilal Oswal Tower Junction of Gokhale &, Sayani Rd, Prabhadevi, Mumbai, Maharashtra 400025, India"
schindler india pvt. ltd.,19.1114693,72.859876,"Corporate Avenue, E - 405, Chakala, Opp Solitaire Corporate Park, Andheri - Kurla Rd, Chakala, Andheri East, Mumbai, Maharashtra 400099, India"
"walchandnagar industries limited, pune",19.0759837,72.8776559,"Mumbai, Maharashtra, India"
petron engineering construction limited,19.0547357,72.88819289999999,"6th Floor, Swastik Chambers, Sion-Trombay Road, Chembur, Swastik Park, Chembur, Mumbai, Maharashtra 400071, India"
ador welding ltd.,19.0759837,72.8776559,"Mumbai, Maharashtra, India"
wuerth  india private limited,19.113436,72.86944,"703 & 704, Sahar Windfall, Sahar Plaza Complex, Sir M V Road, Marol, Andheri East, Bhim Nagar, Andheri East, Mumbai, Maharashtra 400059, India"
gmp technical solutions,19.0941568,72.9146832,"309-316, 3rd Floor, Swastik Disa Business Park, Behind Wadhani Industrial Estate, L.B.S. Marg, Ghatkopar West, Nityanand Nagar, Ghatkopar West, Mumbai, Maharashtra 400086, India"
powerica limited,19.1002837,72.8843172,"Unit 41,mehra estate, kurla road,sakinaka,andheri( 400 072, Safed Pul, Andheri East, Mumbai, Maharashtra 400072, India"
escon elevators pvt ltd,19.2022149,72.8605848,"414, 4th Floor, Gundecha Industrial Estate, Akurli Rd, Kandivali, Akurli Industry Estate, Kandivali East, Mumbai, Maharashtra 400101, India"
geo-chem laboratories pvt ltd,19.1656278,72.94157779999999,"136 Raja Industrial Estate PK Marg, Mulund West, Salpa Devi Pada, Mulund West, Mumbai, Maharashtra 400080, India"
nickunj eximp entp p ltd,18.9412838,72.8266745,"93, Maharshi Karve Rd, Dhobi Talao, New Marine Lines, Marine Lines, Mumbai, Maharashtra 400020, India"
karamtara engineering,19.1413167,72.83331510000001,"705, Morya Landmark II, New Link Road, Andheri West, Veera Desai Industrial Estate, Jogeshwari West, Mumbai, Maharashtra 400053, India"
hawa valves,19.1409054,73.010207,"R-16, Belapur Rd, Sector 8, MIDC Industrial Area, Rabale, Navi Mumbai, Maharashtra 400701, India"
oswal industries limited,18.9595968,72.81749850000001,"3rd Floor, Kartar Mansion, Off Lamington Road, Charni Road East, Shapur Baug, Girgaon, Mumbai, Maharashtra 400004, India"
gemini power hydraulics india pvt. ltd.,19.0470138,72.9115897,"Gemini House, Bus Depot Lane, Deonar, MBPT Colony, Best Colony, Chembur, Mumbai, Maharashtra 400088, India"
shrijee heavy projects works ltd,19.0759837,72.8776559,"Mumbai, Maharashtra, India"
steamline industries limited,19.189239,72.8346081,"Steamline Industries, Malad, Evershine Nagar, Malad West, Mumbai, Maharashtra 400064"
a-1 fence products company pvt. ltd.,19.2621212,72.8714411,"21, Raju Industrial Estate, Penkarpada Road MiraRoad, Dist. Thane, near Dahisar Check Naka, Penkarpada, Mira Road East, Mumbai, Maharashtra 401107, India"
carestream health india pvt. ltd.,19.1023716,72.8631999,"801, Star Hub, Building, 2, Sahar Rd, AAI Colony, J B Nagar, Andheri East, Mumbai, Maharashtra 400059, India"
thyssenkrupp elevator india,19.1168146,72.8675811,"Mulgaon, Andheri East, Mumbai, Maharashtra 400047, India"
glass wall systems,18.9950753,72.83094919999999,"503-504, 5th floor, A wing, Marathon Futurex Mafatlal Mills Compound, NM Joshi Marg, Lower, BDD Chawl, Lower Parel, Mumbai, Maharashtra 400013, India"
hi-fab engineers pvt. ltd.,19.2186781,72.86392529999999,"B-1103, Western Edge II Kanakia Spaces, off Western Express Highway, Food Corporation of India Warehouse, Borivali East, Mumbai, Maharashtra 400066, India"
nrb industrial bearings limited,18.9341546,72.8348164,"2nd Floor, Dhannur, 15, Sir Phirozshah Mehta Rd, Borabazar Precinct, Ballard Estate, Fort, Mumbai, Maharashtra 400001, India"
powermaster engineers private limited,19.0982174,73.0185298,"A 87 TTC industrial area, MIDC Thane-Belapur Road, Khairane Rd, Dhirubhai Ambani Knowledge City, MIDC Industrial Area, Kopar Khairane, Navi Mumbai, Maharashtra 400705, India"
elixir engineering pvt. ltd.,19.1550546,72.8876381,"No. 415-417, Mastermind IV, Royal Palms, Mayur Nagar, Aarey Milk Colony, Goregaon East, Royal Palms Estate, Aarey Colony, Goregaon, Mumbai, Maharashtra 400065, India"
mechwell industries ltd.,18.9728544,72.8417572,"7 - A, Thakkar Industrial Estate, Old Anjirwadi, Mazgaon, Anjeer Wadi, Thakkar Estate, Byculla, Mumbai, Maharashtra 400010, India"
kanadia fyr fyter pvt. ltd.,19.0759837,72.8776559,"Mumbai, Maharashtra, India"
newage fire protection industries pvt. ltd.,19.0425604,72.8638089,"04 Champaklal Udyog Bhawan, Sion East, Sion, Mumbai, Maharashtra 400022, India"
bainite machines private limited,19.1423386,73.0093904,"R-216/217 Area, 4th Road, 400 701, T.T.C. Industrial Area, MIDC Industrial Sector 2, Rabale, Navi Mumbai, Maharashtra 400701, India"
libra techcon ltd,19.0605113,72.8521028,"805/806, Hallmark Business Plaza Gurunanak Hospital Road, Bandra East, Mumbai, Maharashtra 400051, India"
"esp (asia) pvt. ltd.,",19.0074687,72.8412671,"Broadway Center, Dr Baba Saheb Ambedkar Rd, Dadar East, Mumbai, Maharashtra 400014, India"
allstate group,19.0759837,72.8776559,"Mumbai, Maharashtra, India"
extinct fire engineers pvt ltd,19.1060745,72.88054199999999,"Hasan Pada Rd, Chimatpada, Marol, Andheri East, Mumbai, Maharashtra 400059, India"
hydac india,19.0759837,72.8776559,"Mumbai, Maharashtra, India"
kryfs,19.0594572,72.8304331,"3rd Floor, Aza House, 24, Turner Rd, Bandra West, Mumbai, Maharashtra 400050, India"
indiana gratings private limited,19.1099167,72.87988279999999,"Indiana House, Marol Naka, Andheri East, J. B Nagar, Mumbai - 400059, Gamdevi, Marol, Andheri East, Mumbai, Maharashtra 400047, India"
bullows paint equipment pvt ltd,19.1935588,72.9562043,"Ind Est, C 7, Rd Number 12, Wagle Industrial Estate, W City, Thane, Maharashtra 400708, India"
solid vision,19.175547,72.87965129999999,"Nagri Niwara Cooperative Housing Society 6 Sargam Chs-7c, 6, Nagri Niwara Cooperative Housing Society, Goregaon, Mumbai, Maharashtra 400065, India"
pradeep metals limited,19.141458,73.00983599999999,"R-205, Sector 8, MIDC Industrial Area, Rabale, Navi Mumbai, Maharashtra 400701, India"
joseph leslie dynamiks,19.0155121,72.837073,"87 C, Professor, VS Agashe Rd, Dadar West, Mumbai, Maharashtra 400050, India"
unicare emergency equipment,19.0165374,72.83872629999999,"2nd Floor, Leslico House, Prof, VS Agashe Rd, Near Kabutar khana, Dadar West, Dadar, Mumbai, Maharashtra 400028, India"
mhe next engineering pvt ltd,19.09014,73.02356759999999,"C-21/10, S Central Rd, T.T.C. Industrial Area, MIDC Industrial Area, Pawne, Navi Mumbai, Maharashtra 400705, India"
ace pipeline contracts pvt. ltd.,19.0844571,72.8266992,"4, Stanburg Estate, Ground Floor, Juhu Tara Rd, Santacruz, Mumbai, Juhu Koliwada, W, Mumbai, Maharashtra 400049, India"
rotex manufacturers and engineers private limited,19.0759837,72.8776559,"Mumbai, Maharashtra, India"
capital controls india pvt. ltd.,19.0759837,72.8776559,"Mumbai, Maharashtra, India"
advanced bolting solutions p ltd (hytorc),19.0949567,73.01926619999999,"Plot No, W116(A, TTC Industrial Area, MIDC Industrial Area, Kopar Khairane, Navi Mumbai, Maharashtra 400710, India"
hyd-air?? engineering,19.0759837,72.8776559,"Mumbai, Maharashtra, India"
aavishkar group,19.1607298,72.8510241,"6, Corporate Avenue, Sonawala Rd, Sonawala Industry Estate, Goregaon, Mumbai, Maharashtra 400063, India"
vaaman engineers india limited,19.2258027,72.8551732,"510, Sai Leela Commercial Complex, Swami Vivekanand Road, Borivali West, Datta Park, Borivali West, Mumbai, Maharashtra 400092, India"
prama instruments pvt. ltd.,19.1367927,72.85790949999999,"1/1, Yadav & Mishra Compound, Western Express Highway, Jogeshwari East, opposite Asmita Highschool, Thakur Nagar, Bandra Plot, Ambika Nagar, Jogeshwari East, Mumbai, Maharashtra 400060, India"
divide by zero technologies,19.0441442,73.0120115,"M–6/7 & O–1, Neighbourhood Complex, Near SBI Branch Sector 4, Palm Beach Rd, off Sarsole village, Sarsola Village, Nerul West, Nerul, Navi Mumbai, Maharashtra 400706, India"
reynolds chemequip pvt. ltd.,19.1755712,72.87186299999999,"No. 101, General Arun Kumar Vaidya Marg, Malad, Reserve Bank of India Staff Quarters, Pimpripada, Malad East, Mumbai, Maharashtra 400097, India"
ebco private limited,19.111117,72.8877716,"402-3, Hyde Park, Saki Vihar Rd, Ganesh Nagar, Marol, Andheri East, Mumbai, Maharashtra 400072, India"
linit exports private limited,19.2185728,72.8640612,"112/113, Off., Kanakia Western Edge II, Western Edge II, Western Express Hwy, Food Corporation of India Warehouse, Borivali East, Mumbai, Maharashtra 400066, India"
devatech engineers private limited,18.9960626,72.8325417,"3, Mahatma Jyotiba Phule Sadan, S B Pawar Marg, Currey Road, BDD Chawl, Lower Parel, Mumbai, Maharashtra 400013, India"
hindustan composits ltd.,18.9995299,72.8285549,"8th Floor, Peninsula Business Park, A, 801, Ganapatrao Kadam Marg, Lower Parel, Mumbai, Maharashtra 400013, India"
suraj air flow engineers,19.0372023,72.8648104,"Shop No.E3, Building No.1, Indra Nagar, Jaishankar Yagnik Rd, L.T.M.G Hospital Quarters, Sion, Mumbai, Maharashtra 400022, India"
essential power transmission pvt. ltd.,19.1110575,72.88277479999999,"24, Esenpro House, Moral Co-Op Industrial Estate, M V Road, Andheri East, Gamdevi, Marol, Andheri East, Mumbai, Maharashtra 400059, India"
vijay fire vehicles and pumps limited,19.1082399,72.90088519999999,"35,Chandivali Road, Off sakivihar Road,Sangharsh Nagar, -400072, Nahar Amrit Shakti, Chandivali, Andheri East, Mumbai, Maharashtra 400072, India"
jasubhai engineering,19.0699396,72.9984738,"Thacker Tower, 110, Liberty Housing Society, Sector 17, Vashi, Mumbai, Maharashtra 400705, India"
kinam engineering - the heat exchanger specialist,19.0759837,72.8776559,"Mumbai, Maharashtra, India"
jungheinrich lift truck india pvt. ltd.,19.1200672,72.90898659999999,"203/204, 2nd floor, Delphi “A” Wing, Central Avenue, Hiranandani Business Park, Hiranandani Gardens, Panchkutir Ganesh Nagar, Powai, Powai, Mumbai, Maharashtra 400076, India"
saral designs,19.1065137,73.0244929,"EL-11, TTC Industrial Area, MIDC Industrial Area, Mahape, Navi Mumbai, Maharashtra 400710, India"
godrej lawkim motors,19.1079264,72.92631,"Plant 19A first floor, Godrej & Boyce Industry Estate, Vikhroli West, Mumbai, Maharashtra 400079, India"
hnl systems pvt. ltd.,19.1355432,72.8294071,"25/N, Laxmi Industrial Estate, New Link Rd, Laxmi Industrial Estate, Suresh Nagar, Andheri West, W, Maharashtra 400053, India"
adya enterprise,19.0759837,72.8776559,"Mumbai, Maharashtra, India"
remi group of companies,19.0759837,72.8776559,"Mumbai, Maharashtra, India"
gemsons precision engineering pvt ltd,19.1559035,72.8553937,"Plot No, AF-1, Walbhat Rd, Cama Industrial Estate, Goregaon, Mumbai, Maharashtra 400063, India"
hemant tools pvt ltd,18.9982567,72.8252184,"B-2, 909 Marathon Innova, G B Kadam Marg, Opp. Peninsula Corporate Park, Lower Parel, Mumbai, Maharashtra 400013, India"
reliance cementation private ltd.,19.0759837,72.8776559,"Mumbai, Maharashtra, India"
"diligent media corporation ltd,mumbai",19.0759837,72.8776559,"Mumbai, Maharashtra, India"
adnet global,19.1111384,72.85977559999999,"Corporate Ave, Chakala, Andheri East, Mumbai, Maharashtra 400053, India"
republic tv,19.0066038,72.82900360000001,"2R4H+JHH, Kamagar Nagar Number 1, Century Mills, Prabhadevi, Mumbai, Maharashtra 400025, India"
endemol shine india,19.0759837,72.8776559,"Mumbai, Maharashtra, India"
cineom broadcast india pvt. ltd.,19.1769634,72.8367355,"Unit 4c, 4th Floor, Goldline Buisness Centre, 4, New Link Rd, Malad, Ram Nagar, Malad West, Mumbai, Maharashtra 400064, India"
the 120 media collective,18.9942931,72.82648139999999,"Garage Co-working, Sun Mill Compound, 210, Senapati Bapat Marg, Lower Parel, Mumbai, Maharashtra 400013, India"
nimbus communications limited,19.0759837,72.8776559,"Mumbai, Maharashtra, India"
virtual info systems pvt ltd,19.2401855,72.8393555,"Virtual Info Systems Pvt Ltd, Techno It Park, 204 - 207, New Link Rd, next to Eskay Resort, Eksar Village, Eksar, Borivali West, Mumbai, Maharashtra 400091, India"
the viral fever,19.1386371,72.8320969,"702, Fortune Terraces, A wing, New Link Rd, Veera Desai Industrial Estate, Andheri West, Mumbai, Maharashtra 400053, India"
words infocom (p) limited,19.0759837,72.8776559,"Mumbai, Maharashtra, India"
moneylife,19.0249946,72.834852,"316, Hind Service Industries Premises, Shivaji Park Seaface, near Chaityabhoomi, Dadar West, Dadar, Mumbai, Maharashtra 400028, India"
woo-hoo! media entertainment,19.1799106,72.8441167,"306, Quantum Tower, Off S.V. Road, Chincholi, Lane Malad (W, adjacent to HP Petrol Pump, Malad, Nadiyawala Colony 2, Malad West, Mumbai, Maharashtra 400064, India"
studio eeksaurus productions pvt. ltd.,19.0794675,72.8424611,"201, Opulence, 441, Road No. 6, TPS III, Sen Nagar, Santacruz East, Mumbai, Maharashtra 400055, India"
eventfaqs media pvt. ltd,19.136022,72.82796400000001,"35/151 Laxmi Industrial Estate, New Link Rd, Laxmi Industrial Estate, Suresh Nagar, Andheri West, Mumbai, Maharashtra 400053, India"
mars group,19.209773,72.8678551,"AVON PLAZA, ROW, HOUSE C, 2, Kandivali, Gokul Heven, Thakur Complex, KANDIVALI E, Mumbai, Maharashtra 400102, India"
synergy adlabs (big synergy),19.0759837,72.8776559,"Mumbai, Maharashtra, India"
resonance digital,19.1448223,72.85312189999999,"F-802, Lotus Corporate Park Western Express Highway Goregaon East, near Jai Coach, Geetanjali Railway Colony, Laxmi Nagar, Signal, Mumbai, Maharashtra 400063, India"
pixel d studios,19.0759837,72.8776559,"Mumbai, Maharashtra, India"
rangrez films,19.1414528,72.83377999999999,"Off New Link Road, Opp Infinity Mall Maurya Classic, Veera Desai Industrial Estate, Andheri West, Mumbai, Maharashtra 400053, India"
fun factory,19.1372268,72.8277072,"Sundervan Complex Shop No. 2 Shankardham Building, Sundervan Complex, Shastri Nagar, Andheri West, Mumbai, Maharashtra 400053, India"
indus vox media,19.0759837,72.8776559,"Mumbai, Maharashtra, India"
post house,19.1399258,72.8321094,"503, Landmark Building, Veera Desai Industrial Estate, Andheri West, Mumbai, Maharashtra 400053, India"
lighthouse productions,19.0759837,72.8776559,"Mumbai, Maharashtra, India"
bang bang films,19.0317794,72.8463184,"New Era House, Era Mill Compound, 2RJW+PG8, Mogul Lane, Matunga West, Mahim United Industrial Estate, Mahim, Mumbai, Maharashtra 400016, India"
live pixel technologies,19.1088002,73.0182719,"Millenium Business Park, Sector 3, Mahape, Navi Mumbai, Maharashtra 400710, India"
economic and political weekly,18.9995559,72.8235584,"320-322, A to Z Industrial Estate, Ganapatrao Kadam Marg, Lower Parel West, Lower Parel, Mumbai, Maharashtra 400013, India"
pansworld television india pvt ltd,19.1229027,72.8550064,"604, Ashok Heights, Nicholaswadi Lane, Old Nagardas Rd, Gundavali Gaothan, Andheri East, Mumbai, Maharashtra 400069, India"
sphere origins multivision pvt ltd,19.189993,72.83531599999999,"401, Nanak Chambers, Opposite Fun Republic,, Off New Link Road, Andheri (West),, Malad, Evershine Nagar, Malad West, Mumbai, Maharashtra 400053, India"
transasia bio-medicals ltd,19.114957,72.894444,"Chandivali Studio, 8, Chandivali Farm Rd, Chandivali, Powai, Mumbai, Maharashtra 400072, India"
schiller india,19.109459,72.879637,"2nd floor metro station, Advance House, Makwana Rd, near Marol, Gamdevi, Marol, Andheri East, Mumbai, Maharashtra 400059, India"
agd biomedicals (p) ltd.,19.1155857,72.8564176,"AGD Biomedicals (P) Ltd. Mehta Trade Center, No.1, Sir Mathuradas Vasanji Rd, Shivaji Colony, Andheri East, Mumbai, Maharashtra 400059, India"
immunoshop,19.0161599,73.0374603,"309, Raheja Arcade, Sector - 11 CBD, Belapur, Shahbaz Village, Sector 19, CBD Belapur, Navi Mumbai, Maharashtra 400614, India"
remi sales & engineering ltd,43.6551693,-79.37878189999999,"221 Victoria St Suite #203, Toronto, ON M5B 1V4, Canada"
medion healthcare pvt. ltd.,19.0759837,72.8776559,"Mumbai, Maharashtra, India"
coherent medical systems,19.116231,72.849431,"400069, Teli Galli Cross Rd, Sampada Society, Bima Nagar, Andheri East, Mumbai, Maharashtra 400069, India"
accurex biomedical pvt. ltd.,19.0368863,72.84504179999999,"212, Udyog Mandir No 1, 7/C, Bhagoji Keer Marg, Bethany Co-Operative Housing Society, New Dinkar Co Operative Housing Society, Mahim, Mumbai, Maharashtra 400016, India"
illusion dental laboratory pvt ltd,19.1274887,72.83503999999999,"402, Akruti Arcade, J.P.Road, Opp. A.H. Wadia School, Near Andheri Sports Complex, Andheri (W), Azad Nagar, Andheri West, Mumbai, Maharashtra 400058, India"
collateral medical private limited,19.1068086,72.88261899999999,"201 Building, 2, Mittal Industrial Estate Rd, Mittal Industrial Estate, Marol, Andheri East, Mumbai, Maharashtra 400059, India"
medica instrument mfg. co.,18.993704,72.82583980000001,"105/116 Vasan Udyog Bhavan, Sun Mill Compound, Senapati Bapat Marg, Lower Parel, Mumbai, Maharashtra 400013, India"
tosoh india pvt. ltd,19.0759837,72.8776559,"Mumbai, Maharashtra, India"
veol medical technologies p ltd,19.0949271,73.0262343,"A 747, MIDC Pawane, TTC Industrial Area, MIDC Industrial Area, Kopar Khairane, Navi Mumbai, Maharashtra 400705, India"
equinox sales india,19.0759837,72.8776559,"Mumbai, Maharashtra, India"
arphi electronics pvt. ltd.,18.9557664,72.8187081,"D/2, Hermes House, Above Tribhuvandas Bhimji Jewellers, Opera House, Opera House, Charni Road East, Bhatwadi, Girgaon, Mumbai, Maharashtra 400004, India"
s.s. medical systems india private limited,19.0759837,72.8776559,"Mumbai, Maharashtra, India"
